### ISSUE TITLE
marathon and traefik 2.1 dial wrong IP and return 504 gateway timeout 

### ISSUE THREAD

**Issue by kopax** [containous/traefik#6001]
Bug

### What did you do?

I have deployed the following app on marathon: 

```yaml
{
  "id": "/whoami",
  "cpus": 0.1,
  "mem": 256.0,
  "instances": 3,
  "labels": {
    "traefik.enable": "true",
    "traefik.http.routers.whoami.rule": "Host(`traefik-testing.mydomain.com`)",
    "traefik.http.routers.whoami.entrypoints": "web"
  },
  "container": {
    "type": "DOCKER",
    "docker": {
      "image": "containous/whoami",
      "network": "BRIDGE",
      "portMappings": [
        {
          "containerPort": 80,
          "hostPort": 0,
          "name": "http-api",
          "protocol": "tcp"
        }
      ]
    }
  },
  "readinessChecks": [
    {
      "name": "readinessCheck",
      "protocol": "HTTP",
      "path": "/",
      "portName": "http-api",
      "intervalSeconds": 30,
      "timeoutSeconds": 10,
      "httpStatusCodesForReady": [200],
      "preserveLastResponse": false
    }
  ],
  "healthChecks": [
    {
      "path": "/",
      "portIndex": 0,
      "protocol": "HTTP",
      "gracePeriodSeconds": 30,
      "intervalSeconds": 10,
      "timeoutSeconds": 30,
      "maxConsecutiveFailures": 3
    }
  ]
}
```

This is the `docker-compose.yml` used to start the traefik container on `localhost`, that can reach marathon on the LAN through `http://192.168.0.22:8080`:

```yaml
version: '3'
services:
  reverse-proxy:
    image: traefik:v2.1
    network_mode: "host"
    ports:
      - "80:80"
      - "443:443"
      - "8080:8080"
    volumes:
      - "/var/run/docker.sock:/var/run/docker.sock:ro"
      - "./traefik.yaml:/etc/traefik/traefik.yaml"
      - "./letsencrypt:/letsencrypt"
```

### What did you expect to see?

I expect to be able to succeed this command: 

```
curl -H 'Host: traefik-testing.mydomain.com' -L http://localhost
```

### What did you see instead?

Curl response:

```
Gateway Timeout
```

traefik debug log: 

### Output of `traefik version`: (_What version of Traefik are you using?_)

```
v2.1
```

### What is your environment & configuration (arguments, toml, provider, platform, ...)?

This is my `traefik.yaml`

```yaml
log:
  level: "DEBUG"
entryPoints:
  web:
    address: ":80"
  web-secure:
    address: ":443"
providers:
  marathon:
    endpoint: "http://192.168.0.22:8080"
    watch: true
```

### If applicable, please paste the log output in DEBUG level (`--log.level=DEBUG` switch)

```
reverse-proxy_1  | time="2019-12-11T13:45:56Z" level=debug msg="'504 Gateway Timeout' caused by: dial tcp 212.95.74.75:31400: i/o timeout"
```

**Note: the IP it dial as nothing to do with my LAN, it is owned by my ISP and it is not even my WAN address.**

On the dashboard, IP are correctly guessed and all are reachable by telnet from traefik host.

I am out of idea, it simply does not work with marathon, any idea what is failing here? 

Thanks and best!

**Comment by traefiker** [comment]
Hi! I'm Træfiker :robot: the bot in charge of communication regulation.

Thanks for your interest in Traefik!

We dedicate the issue tracker to bug reports and feature requests only. My advanced AI has spotted that your issue might be a configuration problem or relates to something that doesn't look like a bug.

To confirm this, please join our [Community Forum](https://community.containo.us/) and reach out to us on the [Traefik section](https://community.containo.us/c/traefik).

In case I'm wrong (well, that would be embarrassing :sweat_smile:), my developers will re-open the issue and fix me!

In the meantime, you can double check [Traefik's documentation](https://docs.traefik.io/).

**Comment by kopax** [comment]
Thanks @traefiker but I bet you are wrong. I am reading in loop the documentation and my configuration should not behave like that. IP retrieval on marathon seems to have a bug. Can we please investigate?

**Comment by kopax** [comment]
After some investigation, it seems that traefik is having an issue to resolve DNS that can be resolved by the host.

`dial tcp 212.95.74.75:31400: i/o timeout` happen because it's my ISP fall back when accessing a wrong domain. https://212.95.74.75:443 look like this

![image](https://user-images.githubusercontent.com/1866564/70659058-a097df80-1c5f-11ea-8740-24d193bbd794.png)

I expect things to work because the host can talk to any service in my network, instead it fail to resolve a DNS or break something related to DNS that it can't proxy to that DNS served by marathon and fallback to the ISP ip.

I believe there should not have any DNS resolution here and that's most likely a bug....

**Comment by kopax** [comment]
Seems related to https://github.com/containous/traefik/issues/1243

**Comment by kopax** [comment]
I did some tcpdump, 

My `/etc/resolv.conf`:

```
# Generated by NetworkManager
search numericable.fr
nameserver 8.8.8.8
nameserver 8.8.4.4
```

It seems that `dev-11.numericable.fr` is really redirecting to `212.95.74.75`

I was configuring marathon with an intranet `host` (`dev-11`), this was the tcp dump:

```
/ # tcpdump -ni any port 53
tcpdump: verbose output suppressed, use -v or -vv for full protocol decode
listening on any, link-type LINUX_SLL (Linux cooked v1), capture size 262144 bytes


23:37:25.891422 IP 192.168.0.16.34846 > 8.8.8.8.53: 378+ AAAA? dev-11.numericable.fr. (39)
23:37:25.891479 IP 192.168.0.16.50642 > 8.8.8.8.53: 43249+ A? dev-11.numericable.fr. (39)
23:37:25.904896 IP 8.8.8.8.53 > 192.168.0.16.34846: 378 1/1/0 CNAME nc-ass-vip.sdv.fr. (120)
23:37:25.930865 IP 8.8.8.8.53 > 192.168.0.16.50642: 43249 2/0/0 CNAME nc-ass-vip.sdv.fr., A 212.95.74.75 (84)
23:37:26.739694 IP 192.168.0.16.37848 > 8.8.8.8.53: 4284+ A? static.asm.skype.com. (38)
23:37:26.801338 IP 8.8.8.8.53 > 192.168.0.16.37848: 4284 3/0/0 CNAME static-asm-skype.trafficmanager.net., CNAME neu1-authgw.cloudapp.net., A 13.94.102.123 (138)
23:37:41.825827 IP 192.168.0.16.52410 > 8.8.8.8.53: 11463+ A? static.asm.skype.com. (38)
23:37:41.838653 IP 8.8.8.8.53 > 192.168.0.16.52410: 11463 3/0/0 CNAME static-asm-skype.trafficmanager.net., CNAME neu1-authgw.cloudapp.net., A 13.94.102.123 (138)
23:37:41.865510 IP 192.168.0.16.58649 > 8.8.8.8.53: 5711+ A? c1.iggcdn.com. (31)
23:37:41.880401 IP 8.8.8.8.53 > 192.168.0.16.58649: 5711 1/0/0 A 34.102.138.247 (47)
23:37:41.903823 IP 192.168.0.16.57996 > 8.8.8.8.53: 58412+ A? pixel.adsafeprotected.com. (43)
23:37:41.925646 IP 8.8.8.8.53 > 192.168.0.16.57996: 58412 2/0/0 CNAME anycast.pixel.adsafeprotected.com., A 199.166.0.26 (81)
23:37:41.947066 IP 192.168.0.16.60551 > 8.8.8.8.53: 42171+ A? fonts.googleapis.com. (38)
23:37:41.961610 IP 8.8.8.8.53 > 192.168.0.16.60551: 42171 1/0/0 A 216.58.215.42 (54)
23:37:50.180251 IP 192.168.0.16.48654 > 8.8.8.8.53: 14439+ A? d3cv4a9a9wh0bt.cloudfront.net. (47)
23:37:50.191554 IP 8.8.8.8.53 > 192.168.0.16.48654: 14439 4/0/0 A 13.225.84.215, A 13.225.84.133, A 13.225.84.80, A 13.225.84.126 (111)
```

It was fallbacking to `dev-11.numericable.fr`, so I have configured a `fqdn` (`dev-11.yeutech.vn`) with marathon, now the tcpdump look like:  

```

/ # tcpdump -ni any port 53 tcpdump: verbose output suppressed, use -v or -vv for full protocol decode listening on any, link-type LINUX_SLL (Linux cooked v1), capture size 262144 bytes 23:45:51.408693 IP 192.168.0.16.52437 > 8.8.8.8.53: 60928+ A? static.asm.skype.com. (38) 23:45:51.435049 IP 8.8.8.8.53 > 192.168.0.16.52437: 60928 3/0/0 CNAME static-asm-skype.trafficmanager.net., CNAME neu1-authgw.cloudapp.net., A 13.94.102.123 (138) 23:45:51.457513 IP 192.168.0.16.58807 > 8.8.8.8.53: 13877+ A? edge.skype.com. (32) 23:45:51.465513 IP 8.8.8.8.53 > 192.168.0.16.58807: 13877 3/0/0 CNAME edge-skype-com.s-0001.s-msedge.net., CNAME s-0001.s-msedge.net., A 13.107.3.128 (110) 23:45:51.488500 IP 192.168.0.16.51746 > 8.8.8.8.53: 41661+ A? csm.nl.eu.criteo.net. (38) 23:45:51.497684 IP 8.8.8.8.53 > 192.168.0.16.51746: 41661 1/0/0 A 178.250.2.150 (54) 23:45:56.754038 IP 192.168.0.16.56726 > 8.8.8.8.53: 6818+ AAAA? dev-11.yeutech.vn. (35) 23:45:56.754055 IP 192.168.0.16.42437 > 8.8.8.8.53: 59618+ A? dev-11.yeutech.vn. (35) 23:45:57.177981 IP 8.8.8.8.53 > 192.168.0.16.56726: 6818 NXDomain 0/1/0 (91) 23:45:57.178003 IP 8.8.8.8.53 > 192.168.0.16.42437: 59618 NXDomain 0/1/0 (91) 23:45:57.178478 IP 192.168.0.16.40609 > 8.8.8.8.53: 17534+ AAAA? dev-11.yeutech.vn.numericable.fr. (50) 23:45:57.178504 IP 192.168.0.16.54313 > 8.8.8.8.53: 63898+ A? dev-11.yeutech.vn.numericable.fr. (50) 23:45:57.205267 IP 8.8.8.8.53 > 192.168.0.16.54313: 63898 2/0/0 CNAME nc-ass-vip.sdv.fr., A 212.95.74.75 (95) 23:45:57.217886 IP 8.8.8.8.53 > 192.168.0.16.40609: 17534 1/1/0 CNAME nc-ass-vip.sdv.fr. (131) 23:46:06.521472 IP 192.168.0.16.34661 > 8.8.8.8.53: 33403+ A? static.asm.skype.com. (38) 23:46:06.552800 IP 8.8.8.8.53 > 192.168.0.16.34661: 33403 3/0/0 CNAME static-asm-skype.trafficmanager.net., CNAME neu1-authgw.cloudapp.net., A 13.94.102.123 (138) 23:46:06.574352 IP 192.168.0.16.43737 > 8.8.8.8.53: 24754+ A? static-asm.secure.skypeassets.com. (51) 23:46:06.597444 IP 8.8.8.8.53 > 192.168.0.16.43737: 24754 6/0/0 CNAME 1180c.wpc.azureedge.net., CNAME 1180c.ec.azureedge.net., CNAME lb.apr-1180c.edgecastdns.net., CNAME hlb.apr-1180c-0.edgecastdns.net., CNAME cs10.wpc.v0cdn.net., A 68.232.34.200 (225) 23:46:06.618327 IP 192.168.0.16.44711 > 8.8.8.8.53: 51941+ A? www.googleapis.com. (36) 23:46:06.634170 IP 8.8.8.8.53 > 192.168.0.16.44711: 51941 1/0/0 A 216.58.201.234 (52)
--
```

I am still confused, because my `/etc/hosts` is having : 


```
/ # cat /etc/hosts | grep dev-11
192.168.0.22 dev-11.yeutech.vn dev-11
```

host file seems to be ignored by traefik...

**Comment by kopax** [comment]
After doing:

- using marathon with FQDN `dev-11.yeutech.vn` 
- creating a real DNS, `dev-11.yeutech.vn` 
- opening marathon private port publicly 

I was able to query my server. But I don't know how to fix it, because the port can't remain publicly open, and I don't know why `/etc/hosts` does not get resolved causing all those issue.

Any idea?

**Comment by kopax** [comment]
Not related to #1243, it seems that `/etc/hosts` is ignored totally by traeffic. 

Related to https://stackoverflow.com/questions/49476452/traefik-forwarding-to-a-host-and-overriding-ip 

`/etc/nsswitch.conf` is absent from the system, doing:  

    echo "hosts: files dns" > /etc/nsswitch.conf

will solve the issue of `/etc/hosts` being ignore.
