### ISSUE TITLE
502 bad gateway with k8s when setting image

### ISSUE THREAD

**Issue by shengis** [containous/traefik#1384]
### What version of Traefik are you using (`traefik version`)?
Traefik v1.2.1
Kubernetes 1.4.9
Docker 1.12.6

### What is your environment & configuration (arguments, toml...)?
```toml
    # traefik.toml
    defaultEntryPoints = ["http"]
    
    [entryPoints]
      [entryPoints.http]
      address = ":80"
    
    [kubernetes]
```

### What did you do?
I'm using **three** instances of traefik and **three** instances of "emilevauge/whoami" in a testing namespace of kubernetes

```
$ kubectl get deploy,rc,svc,po --namespace tst-traefik -o wide

NAME            DESIRED   CURRENT   UP-TO-DATE   AVAILABLE   AGE
deploy/whoami   3         3         3            3           50m
NAME         DESIRED   CURRENT   READY     AGE       CONTAINER(S)   IMAGE(S)               SELECTOR
rc/traefik   3         3         3         2h        traefik        traefik:1.2.1-alpine   k8s-app=traefik
NAME          CLUSTER-IP      EXTERNAL-IP   PORT(S)           AGE       SELECTOR
svc/traefik   10.115.11.13    <nodes>       80/TCP,8080/TCP   1d        k8s-app=traefik
svc/whoami    10.115.14.178   <none>        80/TCP            50m       app=whoami,environment=tst-traefik
NAME                         READY     STATUS    RESTARTS   AGE       IP             NODE
po/traefik-07ldg             1/1       Running   0          58m       10.110.85.21   worker04
po/traefik-4rpbf             1/1       Running   0          2h        10.110.98.19   worker06
po/traefik-l3m8f             1/1       Running   0          58m       10.110.8.14    worker02
po/whoami-1006074904-25w25   1/1       Running   0          4m        10.110.43.22   worker05
po/whoami-1006074904-e7x0a   1/1       Running   0          4m        10.110.98.22   worker06
po/whoami-1006074904-fdw4u   1/1       Running   0          4m        10.110.8.5     worker02
```

When I'm rolling-update with a set image on the deploy resource :

`kubectl set image deploy/whoami whoami=paulkling/whoami --namespace tst-traefik`

New pods with new internal IPs are sets and old pods are destroyed.

```
$ kubectl get deploy,rc,svc,po --namespace tst-traefik -o wide

NAME            DESIRED   CURRENT   UP-TO-DATE   AVAILABLE   AGE
deploy/whoami   3         3         3            3           52m
NAME         DESIRED   CURRENT   READY     AGE       CONTAINER(S)   IMAGE(S)               SELECTOR
rc/traefik   3         3         3         2h        traefik        traefik:1.2.1-alpine   k8s-app=traefik
NAME          CLUSTER-IP      EXTERNAL-IP   PORT(S)           AGE       SELECTOR
svc/traefik   10.115.11.13    <nodes>       80/TCP,8080/TCP   1d        k8s-app=traefik
svc/whoami    10.115.14.178   <none>        80/TCP            52m       app=whoami,environment=tst-traefik
NAME                         READY     STATUS        RESTARTS   AGE       IP             NODE
po/traefik-07ldg             1/1       Running       0          1h        10.110.85.21   worker04
po/traefik-4rpbf             1/1       Running       0          2h        10.110.98.19   worker06
po/traefik-l3m8f             1/1       Running       0          1h        10.110.8.14    worker02
po/whoami-1006074904-25w25   1/1       Terminating   0          7m        10.110.43.22   worker05
po/whoami-1006074904-e7x0a   1/1       Terminating   0          7m        10.110.98.22   worker06
po/whoami-1006074904-fdw4u   1/1       Terminating   0          7m        10.110.8.5     worker02
po/whoami-3264642165-32o2h   1/1       Running       0          6s        10.110.8.21    worker02
po/whoami-3264642165-3yvok   1/1       Running       0          11s       10.110.35.16   worker03
po/whoami-3264642165-rcy3h   1/1       Running       0          11s       10.110.29.17   worker01
```

Traefik webui is showing the changes correctly for some instances of traefik, and sometimes one of the traefik instances is showing old pod informations (see screenshot).

![capture d ecran de 2017-04-04 17-34-53](https://cloud.githubusercontent.com/assets/20049990/24668154/2ef66ddc-1966-11e7-96ab-ba276a85132e.png)

testing :

```
$ while true; do curl -H 'Host: whoami.***.net' http://traefik-tst.***.net ; done

Hostname: whoami-3264642165-rcy3h
IP: 127.0.0.1
IP: ::1
IP: 10.110.29.17
IP: fe80::42:aff:fe6e:1d11
GET / HTTP/1.1
Host: whoami.***.net
User-Agent: curl/7.51.0
Accept: */*
Accept-Encoding: gzip
X-Forwarded-For: 10.110.29.0
X-Forwarded-Host: whoami.***.net
X-Forwarded-Proto: http
X-Forwarded-Server: traefik-07ldg

Hostname: whoami-3264642165-3yvok
IP: 127.0.0.1
IP: ::1
IP: 10.110.35.16
IP: fe80::42:aff:fe6e:2310
GET / HTTP/1.1
Host: whoami.***.net
User-Agent: curl/7.51.0
Accept: */*
Accept-Encoding: gzip
X-Forwarded-For: 10.110.8.0
X-Forwarded-Host: whoami.***.net
X-Forwarded-Proto: http
X-Forwarded-Server: traefik-4rpbf

Bad Gateway

Hostname: whoami-3264642165-32o2h
IP: 127.0.0.1
IP: ::1
IP: 10.110.8.21
IP: fe80::42:aff:fe6e:815
GET / HTTP/1.1
Host: whoami.***.net
User-Agent: curl/7.51.0
Accept: */*
Accept-Encoding: gzip
X-Forwarded-For: 10.110.29.0
X-Forwarded-Host: whoami.***.net
X-Forwarded-Proto: http
X-Forwarded-Server: traefik-07ldg
```

tcpdump from inside traefik:1.2.1-alpine container :
```
15:40:08.090947 IP (tos 0x0, ttl 42, id 14127, offset 0, flags [DF], proto TCP (6), length 134)
    10.110.43.0.58476 > traefik-l3m8f.80: Flags [P.], cksum 0x0fdd (correct), seq 1:83, ack 1, win 229, options [nop,nop,TS val 833353296 ecr 100729358], length 82: HTTP, length: 82
	GET / HTTP/1.1
	Host: whoami.***.net
	User-Agent: curl/7.51.0
	Accept: */*
	
15:40:08.091156 IP (tos 0x0, ttl 64, id 5800, offset 0, flags [DF], proto TCP (6), length 60)
    traefik-l3m8f.52712 > 10.110.98.22.80: Flags [S], cksum 0x7f2e (incorrect -> 0xee54), seq 2145195196, win 28640, options [mss 1432,sackOK,TS val 100729364 ecr 0,nop,wscale 7], length 0
[...]
15:40:09.856737 IP (tos 0x0, ttl 64, id 13218, offset 0, flags [DF], proto TCP (6), length 189)
    traefik-l3m8f.80 > 10.110.43.0.58476: Flags [P.], cksum 0x4899 (incorrect -> 0x4532), seq 1:138, ack 84, win 222, options [nop,nop,TS val 100729819 ecr 833354265], length 137: HTTP, length: 137
	HTTP/1.1 502 Bad Gateway
	Date: Tue, 04 Apr 2017 15:40:09 GMT
	Content-Length: 11
	Content-Type: text/plain; charset=utf-8
	
	Bad Gateway[!http]
```

### Whoami deployment file
```yml
apiVersion: extensions/v1beta1
kind: Deployment
metadata:
  labels:
    app: whoami
    environment: tst-traefik
  name: whoami
  namespace: tst-traefik
spec:
  replicas: 3
  strategy:
    type: RollingUpdate
    rollingUpdate:
      maxUnavailable: 10%
      maxSurge: 50%
  template:
    metadata:
      labels:
        app: whoami
        environment: tst-traefik
    spec:
      containers:
      - name: whoami
        image: emilevauge/whoami
        imagePullPolicy: Always
        resources:
          limits:
            memory: 400Mi
          requests:
            cpu: 100m
            memory: 200Mi
        ports:
        - containerPort: 80
```

### Whoami ingress file
```yml
apiVersion: extensions/v1beta1
kind: Ingress
metadata:
  name: whoami
  namespace: tst-traefik
spec:
  rules:
  - host: whoami.***.net
    http:
      paths:
      - backend:
          serviceName: whoami
          servicePort: 80
```

### Whoami service file

```yml
apiVersion: v1
kind: Service
metadata:
  labels:
    app: whoami
    environment: tst-traefik
  name: whoami
  namespace: tst-traefik
spec:
  ports:
  - name: http
    port: 80
    targetPort: 80
  selector:
    app: whoami
    environment: tst-traefik
```

**Comment by timoreimann** [comment]
whoami does not do any graceful termination. My guess is you're experiencing the case where requests try to reach a container that is already shutting down and not accepting connections anymore.

For real production services, you would install a SIGTERM handler and keep accepting connections long enough to allow the Ingress LB to detect the Endpoints disappearing and taking the Services out of rotation. Afterwards, the service would finish all in-flight requests and finally terminate (bound by the upper graceful termination period specified in the Pod definition).

**Comment by shengis** [comment]
I have the problem long after the "old pods" have been terminated, like 30min after kubernetes killed those pods. I don't have the problem when I only have one instance of Traefik running (or it's not happening as frequently to me to notice).
Also, I thought Traefik would redirect all the new requests to the new pods while the old pods where terminating ?

**Comment by timoreimann** [comment]
@shengis Traefik is no different from other popular Ingress controllers in the sense that it just continuously watches the set of Services and Endpoints associated with an Ingress and updates the routing rules as the objects change. Traefik does not know when pods are terminating and others are starting; that logic lives with kubelet, which is aware of configured graceful termination handlers and readiness probes so that it can delay changing the exposable state accordingly. See [this blog post](http://containerops.org/2017/01/30/kubernetes-services-and-ingress-under-x-ray/) for some further details.

The only thing related you can do in Traefik is to enable retries, which will make Traefik send requests failing to be served with one container/Endpoint to another one. That's rather meant as a mitigation strategy to unexpected failures, however, not so much to handle the canonical rolling upgrade / shutdown case since it implies increased latency and doesn't come with definite delivery guarantees.

Anyways, that's basically all add-on information -- if you don't see Traefik updating the routing rules after 30 minutes, something significant is broken. Could you please post the output of a `--debug` run while you make a rolling upgrade?

**Comment by shengis** [comment]
@timoreimann : thanks for the great infos !

Here, debug logs from a faulty traefik instance :

```
{"log":"time=\"2017-04-05T08:16:56Z\" level=debug msg=\"Received event from kubernetes \u0026Endpoints{ObjectMeta:ObjectMeta{Name:kube-scheduler,GenerateName:,Namespace:kube-system,SelfLink:/api/v1/namespaces/kube-system/endpoints/kube-scheduler,UID:8b32c29a-15a6-11e7-bc62-000d3a272abe,ResourceVersion:19125805,Generation:0,CreationTimestamp:2017-03-31 00:11:10 +0000 UTC,DeletionTimestamp:\u003cnil\u003e,DeletionGracePeriodSeconds:nil,Labels:map[string]string{},Annotations:map[string]string{control-plane.alpha.kubernetes.io/leader: {\\\"holderIdentity\\\":\\\"manager01\\\",\\\"leaseDurationSeconds\\\":15,\\\"acquireTime\\\":\\\"2017-03-31T00:11:10Z\\\",\\\"renewTime\\\":\\\"2017-04-05T08:16:56Z\\\",\\\"leaderTransitions\\\":0},},OwnerReferences:[],Finalizers:[],ClusterName:,},Subsets:[],}\" \n","stream":"stderr","time":"2017-04-05T08:16:56.87904973Z"}
{"log":"time=\"2017-04-05T08:16:56Z\" level=debug msg=\"Skipping event from kubernetes \u0026Endpoints{ObjectMeta:ObjectMeta{Name:kube-scheduler,GenerateName:,Namespace:kube-system,SelfLink:/api/v1/namespaces/kube-system/endpoints/kube-scheduler,UID:8b32c29a-15a6-11e7-bc62-000d3a272abe,ResourceVersion:19125805,Generation:0,CreationTimestamp:2017-03-31 00:11:10 +0000 UTC,DeletionTimestamp:\u003cnil\u003e,DeletionGracePeriodSeconds:nil,Labels:map[string]string{},Annotations:map[string]string{control-plane.alpha.kubernetes.io/leader: {\\\"holderIdentity\\\":\\\"manager01\\\",\\\"leaseDurationSeconds\\\":15,\\\"acquireTime\\\":\\\"2017-03-31T00:11:10Z\\\",\\\"renewTime\\\":\\\"2017-04-05T08:16:56Z\\\",\\\"leaderTransitions\\\":0},},OwnerReferences:[],Finalizers:[],ClusterName:,},Subsets:[],}\" \n","stream":"stderr","time":"2017-04-05T08:16:56.879075852Z"}
{"log":"time=\"2017-04-05T08:16:57Z\" level=debug msg=\"Received event from kubernetes \u0026Endpoints{ObjectMeta:ObjectMeta{Name:kubernetes,GenerateName:,Namespace:default,SelfLink:/api/v1/namespaces/default/endpoints/kubernetes,UID:0c6ddbce-cba4-11e6-a9fb-000d3a2725f6,ResourceVersion:19125807,Generation:0,CreationTimestamp:2016-12-26 19:46:52 +0000 UTC,DeletionTimestamp:\u003cnil\u003e,DeletionGracePeriodSeconds:nil,Labels:map[string]string{},Annotations:map[string]string{},OwnerReferences:[],Finalizers:[],ClusterName:,},Subsets:[{[{10.100.5.6  \u003cnil\u003e nil}] [] [{https 443 TCP}]}],}\" \n","stream":"stderr","time":"2017-04-05T08:16:57.020466966Z"}
{"log":"time=\"2017-04-05T08:16:57Z\" level=debug msg=\"Skipping event from kubernetes \u0026Endpoints{ObjectMeta:ObjectMeta{Name:kubernetes,GenerateName:,Namespace:default,SelfLink:/api/v1/namespaces/default/endpoints/kubernetes,UID:0c6ddbce-cba4-11e6-a9fb-000d3a2725f6,ResourceVersion:19125807,Generation:0,CreationTimestamp:2016-12-26 19:46:52 +0000 UTC,DeletionTimestamp:\u003cnil\u003e,DeletionGracePeriodSeconds:nil,Labels:map[string]string{},Annotations:map[string]string{},OwnerReferences:[],Finalizers:[],ClusterName:,},Subsets:[{[{10.100.5.6  \u003cnil\u003e nil}] [] [{https 443 TCP}]}],}\" \n","stream":"stderr","time":"2017-04-05T08:16:57.020490162Z"}
{"log":"time=\"2017-04-05T08:16:57Z\" level=debug msg=\"Received event from kubernetes \u0026Endpoints{ObjectMeta:ObjectMeta{Name:kube-controller-manager,GenerateName:,Namespace:kube-system,SelfLink:/api/v1/namespaces/kube-system/endpoints/kube-controller-manager,UID:8a36186e-15a6-11e7-a173-000d3a2725f6,ResourceVersion:19125809,Generation:0,CreationTimestamp:2017-03-31 00:11:08 +0000 UTC,DeletionTimestamp:\u003cnil\u003e,DeletionGracePeriodSeconds:nil,Labels:map[string]string{},Annotations:map[string]string{control-plane.alpha.kubernetes.io/leader: {\\\"holderIdentity\\\":\\\"manager02\\\",\\\"leaseDurationSeconds\\\":15,\\\"acquireTime\\\":\\\"2017-03-31T00:11:08Z\\\",\\\"renewTime\\\":\\\"2017-04-05T08:16:57Z\\\",\\\"leaderTransitions\\\":0},},OwnerReferences:[],Finalizers:[],ClusterName:,},Subsets:[],}\" \n","stream":"stderr","time":"2017-04-05T08:16:57.377114978Z"}
{"log":"time=\"2017-04-05T08:16:57Z\" level=debug msg=\"Skipping event from kubernetes \u0026Endpoints{ObjectMeta:ObjectMeta{Name:kube-controller-manager,GenerateName:,Namespace:kube-system,SelfLink:/api/v1/namespaces/kube-system/endpoints/kube-controller-manager,UID:8a36186e-15a6-11e7-a173-000d3a2725f6,ResourceVersion:19125809,Generation:0,CreationTimestamp:2017-03-31 00:11:08 +0000 UTC,DeletionTimestamp:\u003cnil\u003e,DeletionGracePeriodSeconds:nil,Labels:map[string]string{},Annotations:map[string]string{control-plane.alpha.kubernetes.io/leader: {\\\"holderIdentity\\\":\\\"manager02\\\",\\\"leaseDurationSeconds\\\":15,\\\"acquireTime\\\":\\\"2017-03-31T00:11:08Z\\\",\\\"renewTime\\\":\\\"2017-04-05T08:16:57Z\\\",\\\"leaderTransitions\\\":0},},OwnerReferences:[],Finalizers:[],ClusterName:,},Subsets:[],}\" \n","stream":"stderr","time":"2017-04-05T08:16:57.377137572Z"}
{"log":"time=\"2017-04-05T08:16:58Z\" level=debug msg=\"Round trip: http://10.110.35.10:8080, code: 200, duration: 987.268µs\" \n","stream":"stderr","time":"2017-04-05T08:16:58.827054894Z"}
{"log":"time=\"2017-04-05T08:16:58Z\" level=debug msg=\"Received event from kubernetes \u0026Endpoints{ObjectMeta:ObjectMeta{Name:kube-scheduler,GenerateName:,Namespace:kube-system,SelfLink:/api/v1/namespaces/kube-system/endpoints/kube-scheduler,UID:8b32c29a-15a6-11e7-bc62-000d3a272abe,ResourceVersion:19125825,Generation:0,CreationTimestamp:2017-03-31 00:11:10 +0000 UTC,DeletionTimestamp:\u003cnil\u003e,DeletionGracePeriodSeconds:nil,Labels:map[string]string{},Annotations:map[string]string{control-plane.alpha.kubernetes.io/leader: {\\\"holderIdentity\\\":\\\"manager01\\\",\\\"leaseDurationSeconds\\\":15,\\\"acquireTime\\\":\\\"2017-03-31T00:11:10Z\\\",\\\"renewTime\\\":\\\"2017-04-05T08:16:58Z\\\",\\\"leaderTransitions\\\":0},},OwnerReferences:[],Finalizers:[],ClusterName:,},Subsets:[],}\" \n","stream":"stderr","time":"2017-04-05T08:16:58.963229393Z"}
{"log":"time=\"2017-04-05T08:16:58Z\" level=debug msg=\"Skipping event from kubernetes \u0026Endpoints{ObjectMeta:ObjectMeta{Name:kube-scheduler,GenerateName:,Namespace:kube-system,SelfLink:/api/v1/namespaces/kube-system/endpoints/kube-scheduler,UID:8b32c29a-15a6-11e7-bc62-000d3a272abe,ResourceVersion:19125825,Generation:0,CreationTimestamp:2017-03-31 00:11:10 +0000 UTC,DeletionTimestamp:\u003cnil\u003e,DeletionGracePeriodSeconds:nil,Labels:map[string]string{},Annotations:map[string]string{control-plane.alpha.kubernetes.io/leader: {\\\"holderIdentity\\\":\\\"manager01\\\",\\\"leaseDurationSeconds\\\":15,\\\"acquireTime\\\":\\\"2017-03-31T00:11:10Z\\\",\\\"renewTime\\\":\\\"2017-04-05T08:16:58Z\\\",\\\"leaderTransitions\\\":0},},OwnerReferences:[],Finalizers:[],ClusterName:,},Subsets:[],}\" \n","stream":"stderr","time":"2017-04-05T08:16:58.963254057Z"}
{"log":"time=\"2017-04-05T08:16:59Z\" level=debug msg=\"Received event from kubernetes \u0026Endpoints{ObjectMeta:ObjectMeta{Name:kube-controller-manager,GenerateName:,Namespace:kube-system,SelfLink:/api/v1/namespaces/kube-system/endpoints/kube-controller-manager,UID:8a36186e-15a6-11e7-a173-000d3a2725f6,ResourceVersion:19125827,Generation:0,CreationTimestamp:2017-03-31 00:11:08 +0000 UTC,DeletionTimestamp:\u003cnil\u003e,DeletionGracePeriodSeconds:nil,Labels:map[string]string{},Annotations:map[string]string{control-plane.alpha.kubernetes.io/leader: {\\\"holderIdentity\\\":\\\"manager02\\\",\\\"leaseDurationSeconds\\\":15,\\\"acquireTime\\\":\\\"2017-03-31T00:11:08Z\\\",\\\"renewTime\\\":\\\"2017-04-05T08:16:59Z\\\",\\\"leaderTransitions\\\":0},},OwnerReferences:[],Finalizers:[],ClusterName:,},Subsets:[],}\" \n","stream":"stderr","time":"2017-04-05T08:16:59.349251419Z"}
{"log":"time=\"2017-04-05T08:16:59Z\" level=debug msg=\"Skipping event from kubernetes \u0026Endpoints{ObjectMeta:ObjectMeta{Name:kube-controller-manager,GenerateName:,Namespace:kube-system,SelfLink:/api/v1/namespaces/kube-system/endpoints/kube-controller-manager,UID:8a36186e-15a6-11e7-a173-000d3a2725f6,ResourceVersion:19125827,Generation:0,CreationTimestamp:2017-03-31 00:11:08 +0000 UTC,DeletionTimestamp:\u003cnil\u003e,DeletionGracePeriodSeconds:nil,Labels:map[string]string{},Annotations:map[string]string{control-plane.alpha.kubernetes.io/leader: {\\\"holderIdentity\\\":\\\"manager02\\\",\\\"leaseDurationSeconds\\\":15,\\\"acquireTime\\\":\\\"2017-03-31T00:11:08Z\\\",\\\"renewTime\\\":\\\"2017-04-05T08:16:59Z\\\",\\\"leaderTransitions\\\":0},},OwnerReferences:[],Finalizers:[],ClusterName:,},Subsets:[],}\" \n","stream":"stderr","time":"2017-04-05T08:16:59.349270028Z"}
{"log":"time=\"2017-04-05T08:17:00Z\" level=debug msg=\"Round trip: http://10.110.8.5:8080, code: 200, duration: 359.073µs\" \n","stream":"stderr","time":"2017-04-05T08:17:00.834954648Z"}
{"log":"time=\"2017-04-05T08:17:00Z\" level=debug msg=\"Received event from kubernetes \u0026Endpoints{ObjectMeta:ObjectMeta{Name:kube-scheduler,GenerateName:,Namespace:kube-system,SelfLink:/api/v1/namespaces/kube-system/endpoints/kube-scheduler,UID:8b32c29a-15a6-11e7-bc62-000d3a272abe,ResourceVersion:19125832,Generation:0,CreationTimestamp:2017-03-31 00:11:10 +0000 UTC,DeletionTimestamp:\u003cnil\u003e,DeletionGracePeriodSeconds:nil,Labels:map[string]string{},Annotations:map[string]string{control-plane.alpha.kubernetes.io/leader: {\\\"holderIdentity\\\":\\\"manager01\\\",\\\"leaseDurationSeconds\\\":15,\\\"acquireTime\\\":\\\"2017-03-31T00:11:10Z\\\",\\\"renewTime\\\":\\\"2017-04-05T08:17:00Z\\\",\\\"leaderTransitions\\\":0},},OwnerReferences:[],Finalizers:[],ClusterName:,},Subsets:[],}\" \n","stream":"stderr","time":"2017-04-05T08:17:00.981884014Z"}
{"log":"time=\"2017-04-05T08:17:00Z\" level=debug msg=\"Skipping event from kubernetes \u0026Endpoints{ObjectMeta:ObjectMeta{Name:kube-scheduler,GenerateName:,Namespace:kube-system,SelfLink:/api/v1/namespaces/kube-system/endpoints/kube-scheduler,UID:8b32c29a-15a6-11e7-bc62-000d3a272abe,ResourceVersion:19125832,Generation:0,CreationTimestamp:2017-03-31 00:11:10 +0000 UTC,DeletionTimestamp:\u003cnil\u003e,DeletionGracePeriodSeconds:nil,Labels:map[string]string{},Annotations:map[string]string{control-plane.alpha.kubernetes.io/leader: {\\\"holderIdentity\\\":\\\"manager01\\\",\\\"leaseDurationSeconds\\\":15,\\\"acquireTime\\\":\\\"2017-03-31T00:11:10Z\\\",\\\"renewTime\\\":\\\"2017-04-05T08:17:00Z\\\",\\\"leaderTransitions\\\":0},},OwnerReferences:[],Finalizers:[],ClusterName:,},Subsets:[],}\" \n","stream":"stderr","time":"2017-04-05T08:17:00.98190231Z"}
{"log":"time=\"2017-04-05T08:17:01Z\" level=debug msg=\"Received event from kubernetes \u0026Endpoints{ObjectMeta:ObjectMeta{Name:kube-controller-manager,GenerateName:,Namespace:kube-system,SelfLink:/api/v1/namespaces/kube-system/endpoints/kube-controller-manager,UID:8a36186e-15a6-11e7-a173-000d3a2725f6,ResourceVersion:19125836,Generation:0,CreationTimestamp:2017-03-31 00:11:08 +0000 UTC,DeletionTimestamp:\u003cnil\u003e,DeletionGracePeriodSeconds:nil,Labels:map[string]string{},Annotations:map[string]string{control-plane.alpha.kubernetes.io/leader: {\\\"holderIdentity\\\":\\\"manager02\\\",\\\"leaseDurationSeconds\\\":15,\\\"acquireTime\\\":\\\"2017-03-31T00:11:08Z\\\",\\\"renewTime\\\":\\\"2017-04-05T08:17:01Z\\\",\\\"leaderTransitions\\\":0},},OwnerReferences:[],Finalizers:[],ClusterName:,},Subsets:[],}\" \n","stream":"stderr","time":"2017-04-05T08:17:01.358111958Z"}
{"log":"time=\"2017-04-05T08:17:01Z\" level=debug msg=\"Skipping event from kubernetes \u0026Endpoints{ObjectMeta:ObjectMeta{Name:kube-controller-manager,GenerateName:,Namespace:kube-system,SelfLink:/api/v1/namespaces/kube-system/endpoints/kube-controller-manager,UID:8a36186e-15a6-11e7-a173-000d3a2725f6,ResourceVersion:19125836,Generation:0,CreationTimestamp:2017-03-31 00:11:08 +0000 UTC,DeletionTimestamp:\u003cnil\u003e,DeletionGracePeriodSeconds:nil,Labels:map[string]string{},Annotations:map[string]string{control-plane.alpha.kubernetes.io/leader: {\\\"holderIdentity\\\":\\\"manager02\\\",\\\"leaseDurationSeconds\\\":15,\\\"acquireTime\\\":\\\"2017-03-31T00:11:08Z\\\",\\\"renewTime\\\":\\\"2017-04-05T08:17:01Z\\\",\\\"leaderTransitions\\\":0},},OwnerReferences:[],Finalizers:[],ClusterName:,},Subsets:[],}\" \n","stream":"stderr","time":"2017-04-05T08:17:01.358131348Z"}
{"log":"time=\"2017-04-05T08:17:02Z\" level=debug msg=\"Received event from kubernetes \u0026Endpoints{ObjectMeta:ObjectMeta{Name:kubernetes,GenerateName:,Namespace:default,SelfLink:/api/v1/namespaces/default/endpoints/kubernetes,UID:0c6ddbce-cba4-11e6-a9fb-000d3a2725f6,ResourceVersion:19125843,Generation:0,CreationTimestamp:2016-12-26 19:46:52 +0000 UTC,DeletionTimestamp:\u003cnil\u003e,DeletionGracePeriodSeconds:nil,Labels:map[string]string{},Annotations:map[string]string{},OwnerReferences:[],Finalizers:[],ClusterName:,},Subsets:[{[{10.100.5.5  \u003cnil\u003e nil}] [] [{https 443 TCP}]}],}\" \n","stream":"stderr","time":"2017-04-05T08:17:02.25181453Z"}
{"log":"time=\"2017-04-05T08:17:02Z\" level=debug msg=\"Skipping event from kubernetes \u0026Endpoints{ObjectMeta:ObjectMeta{Name:kubernetes,GenerateName:,Namespace:default,SelfLink:/api/v1/namespaces/default/endpoints/kubernetes,UID:0c6ddbce-cba4-11e6-a9fb-000d3a2725f6,ResourceVersion:19125843,Generation:0,CreationTimestamp:2016-12-26 19:46:52 +0000 UTC,DeletionTimestamp:\u003cnil\u003e,DeletionGracePeriodSeconds:nil,Labels:map[string]string{},Annotations:map[string]string{},OwnerReferences:[],Finalizers:[],ClusterName:,},Subsets:[{[{10.100.5.5  \u003cnil\u003e nil}] [] [{https 443 TCP}]}],}\" \n","stream":"stderr","time":"2017-04-05T08:17:02.251878794Z"}
{"log":"time=\"2017-04-05T08:17:02Z\" level=debug msg=\"Received event from kubernetes \u0026Endpoints{ObjectMeta:ObjectMeta{Name:whoami,GenerateName:,Namespace:tst-traefik,SelfLink:/api/v1/namespaces/tst-traefik/endpoints/whoami,UID:4b0fac51-1944-11e7-a173-000d3a2725f6,ResourceVersion:19125846,Generation:0,CreationTimestamp:2017-04-04 14:37:56 +0000 UTC,DeletionTimestamp:\u003cnil\u003e,DeletionGracePeriodSeconds:nil,Labels:map[string]string{app: whoami,environment: tst-traefik,},Annotations:map[string]string{},OwnerReferences:[],Finalizers:[],ClusterName:,},Subsets:[{[{10.110.35.11  0xc4208c08a0 ObjectReference{Kind:Pod,Namespace:tst-traefik,Name:whoami-3264642165-jp7xq,UID:d24ea25f-19d7-11e7-a173-000d3a2725f6,APIVersion:,ResourceVersion:19125386,FieldPath:,}} {10.110.8.8  0xc4208c0980 \u0026ObjectReference{Kind:Pod,Namespace:tst-traefik,Name:whoami-3264642165-1758g,UID:d00d3c81-19d7-11e7-a173-000d3a2725f6,APIVersion:,ResourceVersion:19125338,FieldPath:,}} {10.110.85.7  0xc4208c0a10 \u0026ObjectReference{Kind:Pod,Namespace:tst-traefik,Name:whoami-1006074904-4fv8v,UID:3cc50874-19d8-11e7-a173-000d3a2725f6,APIVersion:,ResourceVersion:19125842,FieldPath:,}} {10.110.98.8  0xc4208c0ad0 \u0026ObjectReference{Kind:Pod,Namespace:tst-traefik,Name:whoami-3264642165-c9el0,UID:d00d5f76-19d7-11e7-a173-000d3a2725f6,APIVersion:,ResourceVersion:19125343,FieldPath:,}}] [] [{http 80 TCP}]}],}\" \n","stream":"stderr","time":"2017-04-05T08:17:02.420285787Z"}
{"log":"time=\"2017-04-05T08:17:02Z\" level=debug msg=\"Configuration received from provider kubernetes: {\\\"backends\\\":{\\\"traefik-tst.host.net\\\":{\\\"servers\\\":{\\\"traefik-7m7vh\\\":{\\\"url\\\":\\\"http://10.110.8.5:8080\\\",\\\"weight\\\":1},\\\"traefik-vitbe\\\":{\\\"url\\\":\\\"http://10.110.43.17:8080\\\",\\\"weight\\\":1},\\\"traefik-xppdr\\\":{\\\"url\\\":\\\"http://10.110.35.10:8080\\\",\\\"weight\\\":1}},\\\"loadBalancer\\\":{\\\"method\\\":\\\"wrr\\\"}},\\\"whoami.host.net\\\":{\\\"servers\\\":{\\\"whoami-1006074904-4fv8v\\\":{\\\"url\\\":\\\"http://10.110.85.7:80\\\",\\\"weight\\\":1},\\\"whoami-3264642165-1758g\\\":{\\\"url\\\":\\\"http://10.110.8.8:80\\\",\\\"weight\\\":1},\\\"whoami-3264642165-c9el0\\\":{\\\"url\\\":\\\"http://10.110.98.8:80\\\",\\\"weight\\\":1},\\\"whoami-3264642165-jp7xq\\\":{\\\"url\\\":\\\"http://10.110.35.11:80\\\",\\\"weight\\\":1}},\\\"loadBalancer\\\":{\\\"method\\\":\\\"wrr\\\"}}},\\\"frontends\\\":{\\\"traefik-tst.host.net\\\":{\\\"entryPoints\\\":[\\\"http\\\"],\\\"backend\\\":\\\"traefik-tst.host.net\\\",\\\"routes\\\":{\\\"traefik-tst.host.net\\\":{\\\"rule\\\":\\\"Host:traefik-tst.host.net\\\"}},\\\"passHostHeader\\\":true,\\\"priority\\\":0},\\\"whoami.host.net\\\":{\\\"entryPoints\\\":[\\\"http\\\"],\\\"backend\\\":\\\"whoami.host.net\\\",\\\"routes\\\":{\\\"whoami.host.net\\\":{\\\"rule\\\":\\\"Host:whoami.host.net\\\"}},\\\"passHostHeader\\\":true,\\\"priority\\\":0}}}\" \n","stream":"stderr","time":"2017-04-05T08:17:02.420318722Z"}
{"log":"time=\"2017-04-05T08:17:02Z\" level=debug msg=\"Last kubernetes config received more than 2s, OK\" \n","stream":"stderr","time":"2017-04-05T08:17:02.420332378Z"}
{"log":"time=\"2017-04-05T08:17:02Z\" level=debug msg=\"Creating frontend traefik-tst.host.net\" \n","stream":"stderr","time":"2017-04-05T08:17:02.42033519Z"}
{"log":"time=\"2017-04-05T08:17:02Z\" level=debug msg=\"Wiring frontend traefik-tst.host.net to entryPoint http\" \n","stream":"stderr","time":"2017-04-05T08:17:02.420338202Z"}
{"log":"time=\"2017-04-05T08:17:02Z\" level=debug msg=\"Creating route traefik-tst.host.net Host:traefik-tst.host.net\" \n","stream":"stderr","time":"2017-04-05T08:17:02.420341114Z"}
{"log":"time=\"2017-04-05T08:17:02Z\" level=debug msg=\"Creating backend traefik-tst.host.net\" \n","stream":"stderr","time":"2017-04-05T08:17:02.420348645Z"}
{"log":"time=\"2017-04-05T08:17:02Z\" level=debug msg=\"Creating load-balancer wrr\" \n","stream":"stderr","time":"2017-04-05T08:17:02.420351658Z"}
{"log":"time=\"2017-04-05T08:17:02Z\" level=debug msg=\"Creating server traefik-7m7vh at http://10.110.8.5:8080 with weight 1\" \n","stream":"stderr","time":"2017-04-05T08:17:02.420354268Z"}
{"log":"time=\"2017-04-05T08:17:02Z\" level=debug msg=\"Creating server traefik-vitbe at http://10.110.43.17:8080 with weight 1\" \n","stream":"stderr","time":"2017-04-05T08:17:02.42035698Z"}
{"log":"time=\"2017-04-05T08:17:02Z\" level=debug msg=\"Creating server traefik-xppdr at http://10.110.35.10:8080 with weight 1\" \n","stream":"stderr","time":"2017-04-05T08:17:02.420359691Z"}
{"log":"time=\"2017-04-05T08:17:02Z\" level=debug msg=\"Creating frontend whoami.host.net\" \n","stream":"stderr","time":"2017-04-05T08:17:02.420362302Z"}
{"log":"time=\"2017-04-05T08:17:02Z\" level=debug msg=\"Wiring frontend whoami.host.net to entryPoint http\" \n","stream":"stderr","time":"2017-04-05T08:17:02.420368025Z"}
{"log":"time=\"2017-04-05T08:17:02Z\" level=debug msg=\"Creating route whoami.host.net Host:whoami.host.net\" \n","stream":"stderr","time":"2017-04-05T08:17:02.420370636Z"}
{"log":"time=\"2017-04-05T08:17:02Z\" level=debug msg=\"Creating backend whoami.host.net\" \n","stream":"stderr","time":"2017-04-05T08:17:02.420373247Z"}
{"log":"time=\"2017-04-05T08:17:02Z\" level=debug msg=\"Creating load-balancer wrr\" \n","stream":"stderr","time":"2017-04-05T08:17:02.420375657Z"}
{"log":"time=\"2017-04-05T08:17:02Z\" level=debug msg=\"Creating server whoami-3264642165-1758g at http://10.110.8.8:80 with weight 1\" \n","stream":"stderr","time":"2017-04-05T08:17:02.420378267Z"}
{"log":"time=\"2017-04-05T08:17:02Z\" level=debug msg=\"Creating server whoami-3264642165-c9el0 at http://10.110.98.8:80 with weight 1\" \n","stream":"stderr","time":"2017-04-05T08:17:02.420382585Z"}
{"log":"time=\"2017-04-05T08:17:02Z\" level=debug msg=\"Creating server whoami-3264642165-jp7xq at http://10.110.35.11:80 with weight 1\" \n","stream":"stderr","time":"2017-04-05T08:17:02.420385296Z"}
{"log":"time=\"2017-04-05T08:17:02Z\" level=debug msg=\"Creating server whoami-1006074904-4fv8v at http://10.110.85.7:80 with weight 1\" \n","stream":"stderr","time":"2017-04-05T08:17:02.420387907Z"}
{"log":"time=\"2017-04-05T08:17:02Z\" level=info msg=\"Server configuration reloaded on :80\" \n","stream":"stderr","time":"2017-04-05T08:17:02.420390518Z"}
{"log":"time=\"2017-04-05T08:17:02Z\" level=debug msg=\"Received event from kubernetes \u0026Endpoints{ObjectMeta:ObjectMeta{Name:whoami,GenerateName:,Namespace:tst-traefik,SelfLink:/api/v1/namespaces/tst-traefik/endpoints/whoami,UID:4b0fac51-1944-11e7-a173-000d3a2725f6,ResourceVersion:19125854,Generation:0,CreationTimestamp:2017-04-04 14:37:56 +0000 UTC,DeletionTimestamp:\u003cnil\u003e,DeletionGracePeriodSeconds:nil,Labels:map[string]string{app: whoami,environment: tst-traefik,},Annotations:map[string]string{},OwnerReferences:[],Finalizers:[],ClusterName:,},Subsets:[{[{10.110.35.11  0xc420848b70 ObjectReference{Kind:Pod,Namespace:tst-traefik,Name:whoami-3264642165-jp7xq,UID:d24ea25f-19d7-11e7-a173-000d3a2725f6,APIVersion:,ResourceVersion:19125386,FieldPath:,}} {10.110.43.9  0xc4208491b0 \u0026ObjectReference{Kind:Pod,Namespace:tst-traefik,Name:whoami-1006074904-m1za4,UID:3cc50203-19d8-11e7-a173-000d3a2725f6,APIVersion:,ResourceVersion:19125850,FieldPath:,}} {10.110.8.8  0xc42083e1f0 \u0026ObjectReference{Kind:Pod,Namespace:tst-traefik,Name:whoami-3264642165-1758g,UID:d00d3c81-19d7-11e7-a173-000d3a2725f6,APIVersion:,ResourceVersion:19125338,FieldPath:,}} {10.110.85.7  0xc42083e3a0 \u0026ObjectReference{Kind:Pod,Namespace:tst-traefik,Name:whoami-1006074904-4fv8v,UID:3cc50874-19d8-11e7-a173-000d3a2725f6,APIVersion:,ResourceVersion:19125842,FieldPath:,}} {10.110.98.8  0xc42083ea10 \u0026ObjectReference{Kind:Pod,Namespace:tst-traefik,Name:whoami-3264642165-c9el0,UID:d00d5f76-19d7-11e7-a173-000d3a2725f6,APIVersion:,ResourceVersion:19125343,FieldPath:,}}] [] [{http 80 TCP}]}],}\" \n","stream":"stderr","time":"2017-04-05T08:17:02.75969194Z"}
{"log":"time=\"2017-04-05T08:17:02Z\" level=debug msg=\"Configuration received from provider kubernetes: {\\\"backends\\\":{\\\"traefik-tst.host.net\\\":{\\\"servers\\\":{\\\"traefik-7m7vh\\\":{\\\"url\\\":\\\"http://10.110.8.5:8080\\\",\\\"weight\\\":1},\\\"traefik-vitbe\\\":{\\\"url\\\":\\\"http://10.110.43.17:8080\\\",\\\"weight\\\":1},\\\"traefik-xppdr\\\":{\\\"url\\\":\\\"http://10.110.35.10:8080\\\",\\\"weight\\\":1}},\\\"loadBalancer\\\":{\\\"method\\\":\\\"wrr\\\"}},\\\"whoami.host.net\\\":{\\\"servers\\\":{\\\"whoami-1006074904-4fv8v\\\":{\\\"url\\\":\\\"http://10.110.85.7:80\\\",\\\"weight\\\":1},\\\"whoami-1006074904-m1za4\\\":{\\\"url\\\":\\\"http://10.110.43.9:80\\\",\\\"weight\\\":1},\\\"whoami-3264642165-1758g\\\":{\\\"url\\\":\\\"http://10.110.8.8:80\\\",\\\"weight\\\":1},\\\"whoami-3264642165-c9el0\\\":{\\\"url\\\":\\\"http://10.110.98.8:80\\\",\\\"weight\\\":1},\\\"whoami-3264642165-jp7xq\\\":{\\\"url\\\":\\\"http://10.110.35.11:80\\\",\\\"weight\\\":1}},\\\"loadBalancer\\\":{\\\"method\\\":\\\"wrr\\\"}}},\\\"frontends\\\":{\\\"traefik-tst.host.net\\\":{\\\"entryPoints\\\":[\\\"http\\\"],\\\"backend\\\":\\\"traefik-tst.host.net\\\",\\\"routes\\\":{\\\"traefik-tst.host.net\\\":{\\\"rule\\\":\\\"Host:traefik-tst.host.net\\\"}},\\\"passHostHeader\\\":true,\\\"priority\\\":0},\\\"whoami.host.net\\\":{\\\"entryPoints\\\":[\\\"http\\\"],\\\"backend\\\":\\\"whoami.host.net\\\",\\\"routes\\\":{\\\"whoami.host.net\\\":{\\\"rule\\\":\\\"Host:whoami.host.net\\\"}},\\\"passHostHeader\\\":true,\\\"priority\\\":0}}}\" \n","stream":"stderr","time":"2017-04-05T08:17:02.760430781Z"}
{"log":"time=\"2017-04-05T08:17:02Z\" level=debug msg=\"Last kubernetes config received less than 2s, waiting...\" \n","stream":"stderr","time":"2017-04-05T08:17:02.760463013Z"}
{"log":"time=\"2017-04-05T08:17:02Z\" level=debug msg=\"Round trip: http://10.110.8.5:8080, code: 200, duration: 246.916µs\" \n","stream":"stderr","time":"2017-04-05T08:17:02.845923332Z"}
{"log":"time=\"2017-04-05T08:17:02Z\" level=debug msg=\"Received event from kubernetes \u0026Endpoints{ObjectMeta:ObjectMeta{Name:whoami,GenerateName:,Namespace:tst-traefik,SelfLink:/api/v1/namespaces/tst-traefik/endpoints/whoami,UID:4b0fac51-1944-11e7-a173-000d3a2725f6,ResourceVersion:19125857,Generation:0,CreationTimestamp:2017-04-04 14:37:56 +0000 UTC,DeletionTimestamp:\u003cnil\u003e,DeletionGracePeriodSeconds:nil,Labels:map[string]string{app: whoami,environment: tst-traefik,},Annotations:map[string]string{},OwnerReferences:[],Finalizers:[],ClusterName:,},Subsets:[{[{10.110.43.9  0xc4205a8b40 ObjectReference{Kind:Pod,Namespace:tst-traefik,Name:whoami-1006074904-m1za4,UID:3cc50203-19d8-11e7-a173-000d3a2725f6,APIVersion:,ResourceVersion:19125850,FieldPath:,}} {10.110.8.8  0xc4205a8c80 \u0026ObjectReference{Kind:Pod,Namespace:tst-traefik,Name:whoami-3264642165-1758g,UID:d00d3c81-19d7-11e7-a173-000d3a2725f6,APIVersion:,ResourceVersion:19125338,FieldPath:,}} {10.110.85.7  0xc4205a8d40 \u0026ObjectReference{Kind:Pod,Namespace:tst-traefik,Name:whoami-1006074904-4fv8v,UID:3cc50874-19d8-11e7-a173-000d3a2725f6,APIVersion:,ResourceVersion:19125842,FieldPath:,}} {10.110.98.8  0xc4205a8e80 \u0026ObjectReference{Kind:Pod,Namespace:tst-traefik,Name:whoami-3264642165-c9el0,UID:d00d5f76-19d7-11e7-a173-000d3a2725f6,APIVersion:,ResourceVersion:19125343,FieldPath:,}}] [] [{http 80 TCP}]}],}\" \n","stream":"stderr","time":"2017-04-05T08:17:02.964919671Z"}
{"log":"time=\"2017-04-05T08:17:02Z\" level=debug msg=\"Configuration received from provider kubernetes: {\\\"backends\\\":{\\\"traefik-tst.host.net\\\":{\\\"servers\\\":{\\\"traefik-7m7vh\\\":{\\\"url\\\":\\\"http://10.110.8.5:8080\\\",\\\"weight\\\":1},\\\"traefik-vitbe\\\":{\\\"url\\\":\\\"http://10.110.43.17:8080\\\",\\\"weight\\\":1},\\\"traefik-xppdr\\\":{\\\"url\\\":\\\"http://10.110.35.10:8080\\\",\\\"weight\\\":1}},\\\"loadBalancer\\\":{\\\"method\\\":\\\"wrr\\\"}},\\\"whoami.host.net\\\":{\\\"servers\\\":{\\\"whoami-1006074904-4fv8v\\\":{\\\"url\\\":\\\"http://10.110.85.7:80\\\",\\\"weight\\\":1},\\\"whoami-1006074904-m1za4\\\":{\\\"url\\\":\\\"http://10.110.43.9:80\\\",\\\"weight\\\":1},\\\"whoami-3264642165-1758g\\\":{\\\"url\\\":\\\"http://10.110.8.8:80\\\",\\\"weight\\\":1},\\\"whoami-3264642165-c9el0\\\":{\\\"url\\\":\\\"http://10.110.98.8:80\\\",\\\"weight\\\":1}},\\\"loadBalancer\\\":{\\\"method\\\":\\\"wrr\\\"}}},\\\"frontends\\\":{\\\"traefik-tst.host.net\\\":{\\\"entryPoints\\\":[\\\"http\\\"],\\\"backend\\\":\\\"traefik-tst.host.net\\\",\\\"routes\\\":{\\\"traefik-tst.host.net\\\":{\\\"rule\\\":\\\"Host:traefik-tst.host.net\\\"}},\\\"passHostHeader\\\":true,\\\"priority\\\":0},\\\"whoami.host.net\\\":{\\\"entryPoints\\\":[\\\"http\\\"],\\\"backend\\\":\\\"whoami.host.net\\\",\\\"routes\\\":{\\\"whoami.host.net\\\":{\\\"rule\\\":\\\"Host:whoami.host.net\\\"}},\\\"passHostHeader\\\":true,\\\"priority\\\":0}}}\" \n","stream":"stderr","time":"2017-04-05T08:17:02.964937645Z"}
{"log":"time=\"2017-04-05T08:17:02Z\" level=debug msg=\"Last kubernetes config received less than 2s, waiting...\" \n","stream":"stderr","time":"2017-04-05T08:17:02.964959937Z"}
{"log":"time=\"2017-04-05T08:17:03Z\" level=debug msg=\"Received event from kubernetes \u0026Endpoints{ObjectMeta:ObjectMeta{Name:kube-scheduler,GenerateName:,Namespace:kube-system,SelfLink:/api/v1/namespaces/kube-system/endpoints/kube-scheduler,UID:8b32c29a-15a6-11e7-bc62-000d3a272abe,ResourceVersion:19125861,Generation:0,CreationTimestamp:2017-03-31 00:11:10 +0000 UTC,DeletionTimestamp:\u003cnil\u003e,DeletionGracePeriodSeconds:nil,Labels:map[string]string{},Annotations:map[string]string{control-plane.alpha.kubernetes.io/leader: {\\\"holderIdentity\\\":\\\"manager01\\\",\\\"leaseDurationSeconds\\\":15,\\\"acquireTime\\\":\\\"2017-03-31T00:11:10Z\\\",\\\"renewTime\\\":\\\"2017-04-05T08:17:02Z\\\",\\\"leaderTransitions\\\":0},},OwnerReferences:[],Finalizers:[],ClusterName:,},Subsets:[],}\" \n","stream":"stderr","time":"2017-04-05T08:17:03.052732925Z"}
{"log":"time=\"2017-04-05T08:17:03Z\" level=debug msg=\"Skipping event from kubernetes \u0026Endpoints{ObjectMeta:ObjectMeta{Name:kube-scheduler,GenerateName:,Namespace:kube-system,SelfLink:/api/v1/namespaces/kube-system/endpoints/kube-scheduler,UID:8b32c29a-15a6-11e7-bc62-000d3a272abe,ResourceVersion:19125861,Generation:0,CreationTimestamp:2017-03-31 00:11:10 +0000 UTC,DeletionTimestamp:\u003cnil\u003e,DeletionGracePeriodSeconds:nil,Labels:map[string]string{},Annotations:map[string]string{control-plane.alpha.kubernetes.io/leader: {\\\"holderIdentity\\\":\\\"manager01\\\",\\\"leaseDurationSeconds\\\":15,\\\"acquireTime\\\":\\\"2017-03-31T00:11:10Z\\\",\\\"renewTime\\\":\\\"2017-04-05T08:17:02Z\\\",\\\"leaderTransitions\\\":0},},OwnerReferences:[],Finalizers:[],ClusterName:,},Subsets:[],}\" \n","stream":"stderr","time":"2017-04-05T08:17:03.052954615Z"}
{"log":"time=\"2017-04-05T08:17:03Z\" level=debug msg=\"Received event from kubernetes \u0026Endpoints{ObjectMeta:ObjectMeta{Name:kube-controller-manager,GenerateName:,Namespace:kube-system,SelfLink:/api/v1/namespaces/kube-system/endpoints/kube-controller-manager,UID:8a36186e-15a6-11e7-a173-000d3a2725f6,ResourceVersion:19125875,Generation:0,CreationTimestamp:2017-03-31 00:11:08 +0000 UTC,DeletionTimestamp:\u003cnil\u003e,DeletionGracePeriodSeconds:nil,Labels:map[string]string{},Annotations:map[string]string{control-plane.alpha.kubernetes.io/leader: {\\\"holderIdentity\\\":\\\"manager02\\\",\\\"leaseDurationSeconds\\\":15,\\\"acquireTime\\\":\\\"2017-03-31T00:11:08Z\\\",\\\"renewTime\\\":\\\"2017-04-05T08:17:03Z\\\",\\\"leaderTransitions\\\":0},},OwnerReferences:[],Finalizers:[],ClusterName:,},Subsets:[],}\" \n","stream":"stderr","time":"2017-04-05T08:17:03.342366928Z"}
{"log":"time=\"2017-04-05T08:17:03Z\" level=debug msg=\"Skipping event from kubernetes \u0026Endpoints{ObjectMeta:ObjectMeta{Name:kube-controller-manager,GenerateName:,Namespace:kube-system,SelfLink:/api/v1/namespaces/kube-system/endpoints/kube-controller-manager,UID:8a36186e-15a6-11e7-a173-000d3a2725f6,ResourceVersion:19125875,Generation:0,CreationTimestamp:2017-03-31 00:11:08 +0000 UTC,DeletionTimestamp:\u003cnil\u003e,DeletionGracePeriodSeconds:nil,Labels:map[string]string{},Annotations:map[string]string{control-plane.alpha.kubernetes.io/leader: {\\\"holderIdentity\\\":\\\"manager02\\\",\\\"leaseDurationSeconds\\\":15,\\\"acquireTime\\\":\\\"2017-03-31T00:11:08Z\\\",\\\"renewTime\\\":\\\"2017-04-05T08:17:03Z\\\",\\\"leaderTransitions\\\":0},},OwnerReferences:[],Finalizers:[],ClusterName:,},Subsets:[],}\" \n","stream":"stderr","time":"2017-04-05T08:17:03.34239089Z"}
{"log":"time=\"2017-04-05T08:17:03Z\" level=debug msg=\"Received event from kubernetes \u0026Endpoints{ObjectMeta:ObjectMeta{Name:whoami,GenerateName:,Namespace:tst-traefik,SelfLink:/api/v1/namespaces/tst-traefik/endpoints/whoami,UID:4b0fac51-1944-11e7-a173-000d3a2725f6,ResourceVersion:19125879,Generation:0,CreationTimestamp:2017-04-04 14:37:56 +0000 UTC,DeletionTimestamp:\u003cnil\u003e,DeletionGracePeriodSeconds:nil,Labels:map[string]string{app: whoami,environment: tst-traefik,},Annotations:map[string]string{},OwnerReferences:[],Finalizers:[],ClusterName:,},Subsets:[{[{10.110.43.9  0xc4207af550 ObjectReference{Kind:Pod,Namespace:tst-traefik,Name:whoami-1006074904-m1za4,UID:3cc50203-19d8-11e7-a173-000d3a2725f6,APIVersion:,ResourceVersion:19125850,FieldPath:,}} {10.110.85.7  0xc4207af600 \u0026ObjectReference{Kind:Pod,Namespace:tst-traefik,Name:whoami-1006074904-4fv8v,UID:3cc50874-19d8-11e7-a173-000d3a2725f6,APIVersion:,ResourceVersion:19125842,FieldPath:,}} {10.110.98.8  0xc4207af680 \u0026ObjectReference{Kind:Pod,Namespace:tst-traefik,Name:whoami-3264642165-c9el0,UID:d00d5f76-19d7-11e7-a173-000d3a2725f6,APIVersion:,ResourceVersion:19125343,FieldPath:,}}] [] [{http 80 TCP}]}],}\" \n","stream":"stderr","time":"2017-04-05T08:17:03.586012183Z"}
{"log":"time=\"2017-04-05T08:17:03Z\" level=debug msg=\"Configuration received from provider kubernetes: {\\\"backends\\\":{\\\"traefik-tst.host.net\\\":{\\\"servers\\\":{\\\"traefik-7m7vh\\\":{\\\"url\\\":\\\"http://10.110.8.5:8080\\\",\\\"weight\\\":1},\\\"traefik-vitbe\\\":{\\\"url\\\":\\\"http://10.110.43.17:8080\\\",\\\"weight\\\":1},\\\"traefik-xppdr\\\":{\\\"url\\\":\\\"http://10.110.35.10:8080\\\",\\\"weight\\\":1}},\\\"loadBalancer\\\":{\\\"method\\\":\\\"wrr\\\"}},\\\"whoami.host.net\\\":{\\\"servers\\\":{\\\"whoami-1006074904-4fv8v\\\":{\\\"url\\\":\\\"http://10.110.85.7:80\\\",\\\"weight\\\":1},\\\"whoami-1006074904-m1za4\\\":{\\\"url\\\":\\\"http://10.110.43.9:80\\\",\\\"weight\\\":1},\\\"whoami-3264642165-c9el0\\\":{\\\"url\\\":\\\"http://10.110.98.8:80\\\",\\\"weight\\\":1}},\\\"loadBalancer\\\":{\\\"method\\\":\\\"wrr\\\"}}},\\\"frontends\\\":{\\\"traefik-tst.host.net\\\":{\\\"entryPoints\\\":[\\\"http\\\"],\\\"backend\\\":\\\"traefik-tst.host.net\\\",\\\"routes\\\":{\\\"traefik-tst.host.net\\\":{\\\"rule\\\":\\\"Host:traefik-tst.host.net\\\"}},\\\"passHostHeader\\\":true,\\\"priority\\\":0},\\\"whoami.host.net\\\":{\\\"entryPoints\\\":[\\\"http\\\"],\\\"backend\\\":\\\"whoami.host.net\\\",\\\"routes\\\":{\\\"whoami.host.net\\\":{\\\"rule\\\":\\\"Host:whoami.host.net\\\"}},\\\"passHostHeader\\\":true,\\\"priority\\\":0}}}\" \n","stream":"stderr","time":"2017-04-05T08:17:03.586037553Z"}
{"log":"time=\"2017-04-05T08:17:03Z\" level=debug msg=\"Last kubernetes config received less than 2s, waiting...\" \n","stream":"stderr","time":"2017-04-05T08:17:03.586050843Z"}
{"log":"time=\"2017-04-05T08:17:04Z\" level=debug msg=\"Round trip: http://10.110.43.17:8080, code: 200, duration: 831.446µs\" \n","stream":"stderr","time":"2017-04-05T08:17:04.833859596Z"}
{"log":"time=\"2017-04-05T08:17:05Z\" level=debug msg=\"Received event from kubernetes \u0026Endpoints{ObjectMeta:ObjectMeta{Name:kube-scheduler,GenerateName:,Namespace:kube-system,SelfLink:/api/v1/namespaces/kube-system/endpoints/kube-scheduler,UID:8b32c29a-15a6-11e7-bc62-000d3a272abe,ResourceVersion:19125891,Generation:0,CreationTimestamp:2017-03-31 00:11:10 +0000 UTC,DeletionTimestamp:\u003cnil\u003e,DeletionGracePeriodSeconds:nil,Labels:map[string]string{},Annotations:map[string]string{control-plane.alpha.kubernetes.io/leader: {\\\"holderIdentity\\\":\\\"manager01\\\",\\\"leaseDurationSeconds\\\":15,\\\"acquireTime\\\":\\\"2017-03-31T00:11:10Z\\\",\\\"renewTime\\\":\\\"2017-04-05T08:17:04Z\\\",\\\"leaderTransitions\\\":0},},OwnerReferences:[],Finalizers:[],ClusterName:,},Subsets:[],}\" \n","stream":"stderr","time":"2017-04-05T08:17:05.091817548Z"}
{"log":"time=\"2017-04-05T08:17:05Z\" level=debug msg=\"Skipping event from kubernetes \u0026Endpoints{ObjectMeta:ObjectMeta{Name:kube-scheduler,GenerateName:,Namespace:kube-system,SelfLink:/api/v1/namespaces/kube-system/endpoints/kube-scheduler,UID:8b32c29a-15a6-11e7-bc62-000d3a272abe,ResourceVersion:19125891,Generation:0,CreationTimestamp:2017-03-31 00:11:10 +0000 UTC,DeletionTimestamp:\u003cnil\u003e,DeletionGracePeriodSeconds:nil,Labels:map[string]string{},Annotations:map[string]string{control-plane.alpha.kubernetes.io/leader: {\\\"holderIdentity\\\":\\\"manager01\\\",\\\"leaseDurationSeconds\\\":15,\\\"acquireTime\\\":\\\"2017-03-31T00:11:10Z\\\",\\\"renewTime\\\":\\\"2017-04-05T08:17:04Z\\\",\\\"leaderTransitions\\\":0},},OwnerReferences:[],Finalizers:[],ClusterName:,},Subsets:[],}\" \n","stream":"stderr","time":"2017-04-05T08:17:05.091840268Z"}
{"log":"time=\"2017-04-05T08:17:05Z\" level=debug msg=\"Received event from kubernetes \u0026Endpoints{ObjectMeta:ObjectMeta{Name:kube-controller-manager,GenerateName:,Namespace:kube-system,SelfLink:/api/v1/namespaces/kube-system/endpoints/kube-controller-manager,UID:8a36186e-15a6-11e7-a173-000d3a2725f6,ResourceVersion:19125892,Generation:0,CreationTimestamp:2017-03-31 00:11:08 +0000 UTC,DeletionTimestamp:\u003cnil\u003e,DeletionGracePeriodSeconds:nil,Labels:map[string]string{},Annotations:map[string]string{control-plane.alpha.kubernetes.io/leader: {\\\"holderIdentity\\\":\\\"manager02\\\",\\\"leaseDurationSeconds\\\":15,\\\"acquireTime\\\":\\\"2017-03-31T00:11:08Z\\\",\\\"renewTime\\\":\\\"2017-04-05T08:17:05Z\\\",\\\"leaderTransitions\\\":0},},OwnerReferences:[],Finalizers:[],ClusterName:,},Subsets:[],}\" \n","stream":"stderr","time":"2017-04-05T08:17:05.341423985Z"}
{"log":"time=\"2017-04-05T08:17:05Z\" level=debug msg=\"Skipping event from kubernetes \u0026Endpoints{ObjectMeta:ObjectMeta{Name:kube-controller-manager,GenerateName:,Namespace:kube-system,SelfLink:/api/v1/namespaces/kube-system/endpoints/kube-controller-manager,UID:8a36186e-15a6-11e7-a173-000d3a2725f6,ResourceVersion:19125892,Generation:0,CreationTimestamp:2017-03-31 00:11:08 +0000 UTC,DeletionTimestamp:\u003cnil\u003e,DeletionGracePeriodSeconds:nil,Labels:map[string]string{},Annotations:map[string]string{control-plane.alpha.kubernetes.io/leader: {\\\"holderIdentity\\\":\\\"manager02\\\",\\\"leaseDurationSeconds\\\":15,\\\"acquireTime\\\":\\\"2017-03-31T00:11:08Z\\\",\\\"renewTime\\\":\\\"2017-04-05T08:17:05Z\\\",\\\"leaderTransitions\\\":0},},OwnerReferences:[],Finalizers:[],ClusterName:,},Subsets:[],}\" \n","stream":"stderr","time":"2017-04-05T08:17:05.341448112Z"}
{"log":"time=\"2017-04-05T08:17:05Z\" level=debug msg=\"Waited for kubernetes config, OK\" \n","stream":"stderr","time":"2017-04-05T08:17:05.584416963Z"}
{"log":"time=\"2017-04-05T08:17:05Z\" level=debug msg=\"Creating frontend traefik-tst.host.net\" \n","stream":"stderr","time":"2017-04-05T08:17:05.584439582Z"}
{"log":"time=\"2017-04-05T08:17:05Z\" level=debug msg=\"Wiring frontend traefik-tst.host.net to entryPoint http\" \n","stream":"stderr","time":"2017-04-05T08:17:05.584443302Z"}
{"log":"time=\"2017-04-05T08:17:05Z\" level=debug msg=\"Creating route traefik-tst.host.net Host:traefik-tst.host.net\" \n","stream":"stderr","time":"2017-04-05T08:17:05.584446619Z"}
{"log":"time=\"2017-04-05T08:17:05Z\" level=debug msg=\"Creating backend traefik-tst.host.net\" \n","stream":"stderr","time":"2017-04-05T08:17:05.584449434Z"}
{"log":"time=\"2017-04-05T08:17:05Z\" level=debug msg=\"Creating load-balancer wrr\" \n","stream":"stderr","time":"2017-04-05T08:17:05.58445235Z"}
{"log":"time=\"2017-04-05T08:17:05Z\" level=debug msg=\"Creating server traefik-vitbe at http://10.110.43.17:8080 with weight 1\" \n","stream":"stderr","time":"2017-04-05T08:17:05.584455165Z"}
{"log":"time=\"2017-04-05T08:17:05Z\" level=debug msg=\"Creating server traefik-xppdr at http://10.110.35.10:8080 with weight 1\" \n","stream":"stderr","time":"2017-04-05T08:17:05.58445808Z"}
{"log":"time=\"2017-04-05T08:17:05Z\" level=debug msg=\"Creating server traefik-7m7vh at http://10.110.8.5:8080 with weight 1\" \n","stream":"stderr","time":"2017-04-05T08:17:05.584460794Z"}
{"log":"time=\"2017-04-05T08:17:05Z\" level=debug msg=\"Creating frontend whoami.host.net\" \n","stream":"stderr","time":"2017-04-05T08:17:05.584463609Z"}
{"log":"time=\"2017-04-05T08:17:05Z\" level=debug msg=\"Wiring frontend whoami.host.net to entryPoint http\" \n","stream":"stderr","time":"2017-04-05T08:17:05.584466223Z"}
{"log":"time=\"2017-04-05T08:17:05Z\" level=debug msg=\"Creating route whoami.host.net Host:whoami.host.net\" \n","stream":"stderr","time":"2017-04-05T08:17:05.584491958Z"}
{"log":"time=\"2017-04-05T08:17:05Z\" level=debug msg=\"Creating backend whoami.host.net\" \n","stream":"stderr","time":"2017-04-05T08:17:05.584496181Z"}
{"log":"time=\"2017-04-05T08:17:05Z\" level=debug msg=\"Creating load-balancer wrr\" \n","stream":"stderr","time":"2017-04-05T08:17:05.584498794Z"}
{"log":"time=\"2017-04-05T08:17:05Z\" level=debug msg=\"Creating server whoami-3264642165-c9el0 at http://10.110.98.8:80 with weight 1\" \n","stream":"stderr","time":"2017-04-05T08:17:05.584501509Z"}
{"log":"time=\"2017-04-05T08:17:05Z\" level=debug msg=\"Creating server whoami-1006074904-4fv8v at http://10.110.85.7:80 with weight 1\" \n","stream":"stderr","time":"2017-04-05T08:17:05.584504223Z"}
{"log":"time=\"2017-04-05T08:17:05Z\" level=debug msg=\"Creating server whoami-1006074904-m1za4 at http://10.110.43.9:80 with weight 1\" \n","stream":"stderr","time":"2017-04-05T08:17:05.584515181Z"}
{"log":"time=\"2017-04-05T08:17:05Z\" level=info msg=\"Server configuration reloaded on :80\" \n","stream":"stderr","time":"2017-04-05T08:17:05.584519504Z"}
{"log":"time=\"2017-04-05T08:17:06Z\" level=debug msg=\"Received event from kubernetes \u0026Endpoints{ObjectMeta:ObjectMeta{Name:whoami,GenerateName:,Namespace:tst-traefik,SelfLink:/api/v1/namespaces/tst-traefik/endpoints/whoami,UID:4b0fac51-1944-11e7-a173-000d3a2725f6,ResourceVersion:19125899,Generation:0,CreationTimestamp:2017-04-04 14:37:56 +0000 UTC,DeletionTimestamp:\u003cnil\u003e,DeletionGracePeriodSeconds:nil,Labels:map[string]string{app: whoami,environment: tst-traefik,},Annotations:map[string]string{},OwnerReferences:[],Finalizers:[],ClusterName:,},Subsets:[{[{10.110.35.8  0xc420282670 ObjectReference{Kind:Pod,Namespace:tst-traefik,Name:whoami-1006074904-vo868,UID:3f954d1a-19d8-11e7-a173-000d3a2725f6,APIVersion:,ResourceVersion:19125897,FieldPath:,}} {10.110.43.9  0xc4202826f0 \u0026ObjectReference{Kind:Pod,Namespace:tst-traefik,Name:whoami-1006074904-m1za4,UID:3cc50203-19d8-11e7-a173-000d3a2725f6,APIVersion:,ResourceVersion:19125850,FieldPath:,}} {10.110.85.7  0xc420282770 \u0026ObjectReference{Kind:Pod,Namespace:tst-traefik,Name:whoami-1006074904-4fv8v,UID:3cc50874-19d8-11e7-a173-000d3a2725f6,APIVersion:,ResourceVersion:19125842,FieldPath:,}} {10.110.98.8  0xc4202827f0 \u0026ObjectReference{Kind:Pod,Namespace:tst-traefik,Name:whoami-3264642165-c9el0,UID:d00d5f76-19d7-11e7-a173-000d3a2725f6,APIVersion:,ResourceVersion:19125343,FieldPath:,}}] [] [{http 80 TCP}]}],}\" \n","stream":"stderr","time":"2017-04-05T08:17:06.775688393Z"}
{"log":"time=\"2017-04-05T08:17:06Z\" level=debug msg=\"Configuration received from provider kubernetes: {\\\"backends\\\":{\\\"traefik-tst.host.net\\\":{\\\"servers\\\":{\\\"traefik-7m7vh\\\":{\\\"url\\\":\\\"http://10.110.8.5:8080\\\",\\\"weight\\\":1},\\\"traefik-vitbe\\\":{\\\"url\\\":\\\"http://10.110.43.17:8080\\\",\\\"weight\\\":1},\\\"traefik-xppdr\\\":{\\\"url\\\":\\\"http://10.110.35.10:8080\\\",\\\"weight\\\":1}},\\\"loadBalancer\\\":{\\\"method\\\":\\\"wrr\\\"}},\\\"whoami.host.net\\\":{\\\"servers\\\":{\\\"whoami-1006074904-4fv8v\\\":{\\\"url\\\":\\\"http://10.110.85.7:80\\\",\\\"weight\\\":1},\\\"whoami-1006074904-m1za4\\\":{\\\"url\\\":\\\"http://10.110.43.9:80\\\",\\\"weight\\\":1},\\\"whoami-1006074904-vo868\\\":{\\\"url\\\":\\\"http://10.110.35.8:80\\\",\\\"weight\\\":1},\\\"whoami-3264642165-c9el0\\\":{\\\"url\\\":\\\"http://10.110.98.8:80\\\",\\\"weight\\\":1}},\\\"loadBalancer\\\":{\\\"method\\\":\\\"wrr\\\"}}},\\\"frontends\\\":{\\\"traefik-tst.host.net\\\":{\\\"entryPoints\\\":[\\\"http\\\"],\\\"backend\\\":\\\"traefik-tst.host.net\\\",\\\"routes\\\":{\\\"traefik-tst.host.net\\\":{\\\"rule\\\":\\\"Host:traefik-tst.host.net\\\"}},\\\"passHostHeader\\\":true,\\\"priority\\\":0},\\\"whoami.host.net\\\":{\\\"entryPoints\\\":[\\\"http\\\"],\\\"backend\\\":\\\"whoami.host.net\\\",\\\"routes\\\":{\\\"whoami.host.net\\\":{\\\"rule\\\":\\\"Host:whoami.host.net\\\"}},\\\"passHostHeader\\\":true,\\\"priority\\\":0}}}\" \n","stream":"stderr","time":"2017-04-05T08:17:06.775726873Z"}
{"log":"time=\"2017-04-05T08:17:06Z\" level=debug msg=\"Last kubernetes config received more than 2s, OK\" \n","stream":"stderr","time":"2017-04-05T08:17:06.775746062Z"}
{"log":"time=\"2017-04-05T08:17:06Z\" level=debug msg=\"Creating frontend traefik-tst.host.net\" \n","stream":"stderr","time":"2017-04-05T08:17:06.775749378Z"}
{"log":"time=\"2017-04-05T08:17:06Z\" level=debug msg=\"Wiring frontend traefik-tst.host.net to entryPoint http\" \n","stream":"stderr","time":"2017-04-05T08:17:06.775752392Z"}
{"log":"time=\"2017-04-05T08:17:06Z\" level=debug msg=\"Creating route traefik-tst.host.net Host:traefik-tst.host.net\" \n","stream":"stderr","time":"2017-04-05T08:17:06.775755406Z"}
{"log":"time=\"2017-04-05T08:17:06Z\" level=debug msg=\"Creating backend traefik-tst.host.net\" \n","stream":"stderr","time":"2017-04-05T08:17:06.775766759Z"}
{"log":"time=\"2017-04-05T08:17:06Z\" level=debug msg=\"Creating load-balancer wrr\" \n","stream":"stderr","time":"2017-04-05T08:17:06.775769773Z"}
{"log":"time=\"2017-04-05T08:17:06Z\" level=debug msg=\"Creating server traefik-7m7vh at http://10.110.8.5:8080 with weight 1\" \n","stream":"stderr","time":"2017-04-05T08:17:06.775772386Z"}
{"log":"time=\"2017-04-05T08:17:06Z\" level=debug msg=\"Creating server traefik-vitbe at http://10.110.43.17:8080 with weight 1\" \n","stream":"stderr","time":"2017-04-05T08:17:06.775775098Z"}
{"log":"time=\"2017-04-05T08:17:06Z\" level=debug msg=\"Creating server traefik-xppdr at http://10.110.35.10:8080 with weight 1\" \n","stream":"stderr","time":"2017-04-05T08:17:06.77577771Z"}
{"log":"time=\"2017-04-05T08:17:06Z\" level=debug msg=\"Creating frontend whoami.host.net\" \n","stream":"stderr","time":"2017-04-05T08:17:06.775780524Z"}
{"log":"time=\"2017-04-05T08:17:06Z\" level=debug msg=\"Wiring frontend whoami.host.net to entryPoint http\" \n","stream":"stderr","time":"2017-04-05T08:17:06.775783035Z"}
{"log":"time=\"2017-04-05T08:17:06Z\" level=debug msg=\"Creating route whoami.host.net Host:whoami.host.net\" \n","stream":"stderr","time":"2017-04-05T08:17:06.775785648Z"}
{"log":"time=\"2017-04-05T08:17:06Z\" level=debug msg=\"Creating backend whoami.host.net\" \n","stream":"stderr","time":"2017-04-05T08:17:06.77578826Z"}
{"log":"time=\"2017-04-05T08:17:06Z\" level=debug msg=\"Creating load-balancer wrr\" \n","stream":"stderr","time":"2017-04-05T08:17:06.775790772Z"}
{"log":"time=\"2017-04-05T08:17:06Z\" level=debug msg=\"Creating server whoami-1006074904-vo868 at http://10.110.35.8:80 with weight 1\" \n","stream":"stderr","time":"2017-04-05T08:17:06.775793283Z"}
{"log":"time=\"2017-04-05T08:17:06Z\" level=debug msg=\"Creating server whoami-3264642165-c9el0 at http://10.110.98.8:80 with weight 1\" \n","stream":"stderr","time":"2017-04-05T08:17:06.7757968Z"}
{"log":"time=\"2017-04-05T08:17:06Z\" level=debug msg=\"Creating server whoami-1006074904-4fv8v at http://10.110.85.7:80 with weight 1\" \n","stream":"stderr","time":"2017-04-05T08:17:06.775799613Z"}
{"log":"time=\"2017-04-05T08:17:06Z\" level=debug msg=\"Creating server whoami-1006074904-m1za4 at http://10.110.43.9:80 with weight 1\" \n","stream":"stderr","time":"2017-04-05T08:17:06.775802225Z"}
{"log":"time=\"2017-04-05T08:17:06Z\" level=info msg=\"Server configuration reloaded on :80\" \n","stream":"stderr","time":"2017-04-05T08:17:06.775804837Z"}
{"log":"time=\"2017-04-05T08:17:06Z\" level=debug msg=\"Round trip: http://10.110.8.5:8080, code: 200, duration: 363.5µs\" \n","stream":"stderr","time":"2017-04-05T08:17:06.842529304Z"}
{"log":"time=\"2017-04-05T08:17:06Z\" level=debug msg=\"Received event from kubernetes \u0026Endpoints{ObjectMeta:ObjectMeta{Name:kubernetes,GenerateName:,Namespace:default,SelfLink:/api/v1/namespaces/default/endpoints/kubernetes,UID:0c6ddbce-cba4-11e6-a9fb-000d3a2725f6,ResourceVersion:19125903,Generation:0,CreationTimestamp:2016-12-26 19:46:52 +0000 UTC,DeletionTimestamp:\u003cnil\u003e,DeletionGracePeriodSeconds:nil,Labels:map[string]string{},Annotations:map[string]string{},OwnerReferences:[],Finalizers:[],ClusterName:,},Subsets:[{[{10.100.5.6  \u003cnil\u003e nil}] [] [{https 443 TCP}]}],}\" \n","stream":"stderr","time":"2017-04-05T08:17:06.948688506Z"}
{"log":"time=\"2017-04-05T08:17:06Z\" level=debug msg=\"Skipping event from kubernetes \u0026Endpoints{ObjectMeta:ObjectMeta{Name:kubernetes,GenerateName:,Namespace:default,SelfLink:/api/v1/namespaces/default/endpoints/kubernetes,UID:0c6ddbce-cba4-11e6-a9fb-000d3a2725f6,ResourceVersion:19125903,Generation:0,CreationTimestamp:2016-12-26 19:46:52 +0000 UTC,DeletionTimestamp:\u003cnil\u003e,DeletionGracePeriodSeconds:nil,Labels:map[string]string{},Annotations:map[string]string{},OwnerReferences:[],Finalizers:[],ClusterName:,},Subsets:[{[{10.100.5.6  \u003cnil\u003e nil}] [] [{https 443 TCP}]}],}\" \n","stream":"stderr","time":"2017-04-05T08:17:06.948779029Z"}
{"log":"time=\"2017-04-05T08:17:06Z\" level=debug msg=\"Received event from kubernetes \u0026Endpoints{ObjectMeta:ObjectMeta{Name:whoami,GenerateName:,Namespace:tst-traefik,SelfLink:/api/v1/namespaces/tst-traefik/endpoints/whoami,UID:4b0fac51-1944-11e7-a173-000d3a2725f6,ResourceVersion:19125905,Generation:0,CreationTimestamp:2017-04-04 14:37:56 +0000 UTC,DeletionTimestamp:\u003cnil\u003e,DeletionGracePeriodSeconds:nil,Labels:map[string]string{app: whoami,environment: tst-traefik,},Annotations:map[string]string{},OwnerReferences:[],Finalizers:[],ClusterName:,},Subsets:[{[{10.110.35.8  0xc420240ec0 ObjectReference{Kind:Pod,Namespace:tst-traefik,Name:whoami-1006074904-vo868,UID:3f954d1a-19d8-11e7-a173-000d3a2725f6,APIVersion:,ResourceVersion:19125897,FieldPath:,}} {10.110.43.9  0xc420240f40 \u0026ObjectReference{Kind:Pod,Namespace:tst-traefik,Name:whoami-1006074904-m1za4,UID:3cc50203-19d8-11e7-a173-000d3a2725f6,APIVersion:,ResourceVersion:19125850,FieldPath:,}} {10.110.85.7  0xc420240fc0 \u0026ObjectReference{Kind:Pod,Namespace:tst-traefik,Name:whoami-1006074904-4fv8v,UID:3cc50874-19d8-11e7-a173-000d3a2725f6,APIVersion:,ResourceVersion:19125842,FieldPath:,}}] [] [{http 80 TCP}]}],}\" \n","stream":"stderr","time":"2017-04-05T08:17:06.996063878Z"}
{"log":"time=\"2017-04-05T08:17:06Z\" level=debug msg=\"Configuration received from provider kubernetes: {\\\"backends\\\":{\\\"traefik-tst.host.net\\\":{\\\"servers\\\":{\\\"traefik-7m7vh\\\":{\\\"url\\\":\\\"http://10.110.8.5:8080\\\",\\\"weight\\\":1},\\\"traefik-vitbe\\\":{\\\"url\\\":\\\"http://10.110.43.17:8080\\\",\\\"weight\\\":1},\\\"traefik-xppdr\\\":{\\\"url\\\":\\\"http://10.110.35.10:8080\\\",\\\"weight\\\":1}},\\\"loadBalancer\\\":{\\\"method\\\":\\\"wrr\\\"}},\\\"whoami.host.net\\\":{\\\"servers\\\":{\\\"whoami-1006074904-4fv8v\\\":{\\\"url\\\":\\\"http://10.110.85.7:80\\\",\\\"weight\\\":1},\\\"whoami-1006074904-m1za4\\\":{\\\"url\\\":\\\"http://10.110.43.9:80\\\",\\\"weight\\\":1},\\\"whoami-1006074904-vo868\\\":{\\\"url\\\":\\\"http://10.110.35.8:80\\\",\\\"weight\\\":1}},\\\"loadBalancer\\\":{\\\"method\\\":\\\"wrr\\\"}}},\\\"frontends\\\":{\\\"traefik-tst.host.net\\\":{\\\"entryPoints\\\":[\\\"http\\\"],\\\"backend\\\":\\\"traefik-tst.host.net\\\",\\\"routes\\\":{\\\"traefik-tst.host.net\\\":{\\\"rule\\\":\\\"Host:traefik-tst.host.net\\\"}},\\\"passHostHeader\\\":true,\\\"priority\\\":0},\\\"whoami.host.net\\\":{\\\"entryPoints\\\":[\\\"http\\\"],\\\"backend\\\":\\\"whoami.host.net\\\",\\\"routes\\\":{\\\"whoami.host.net\\\":{\\\"rule\\\":\\\"Host:whoami.host.net\\\"}},\\\"passHostHeader\\\":true,\\\"priority\\\":0}}}\" \n","stream":"stderr","time":"2017-04-05T08:17:06.996867938Z"}
{"log":"time=\"2017-04-05T08:17:06Z\" level=debug msg=\"Last kubernetes config received less than 2s, waiting...\" \n","stream":"stderr","time":"2017-04-05T08:17:06.99688743Z"}
{"log":"time=\"2017-04-05T08:17:07Z\" level=debug msg=\"Received event from kubernetes \u0026Endpoints{ObjectMeta:ObjectMeta{Name:kube-scheduler,GenerateName:,Namespace:kube-system,SelfLink:/api/v1/namespaces/kube-system/endpoints/kube-scheduler,UID:8b32c29a-15a6-11e7-bc62-000d3a272abe,ResourceVersion:19125911,Generation:0,CreationTimestamp:2017-03-31 00:11:10 +0000 UTC,DeletionTimestamp:\u003cnil\u003e,DeletionGracePeriodSeconds:nil,Labels:map[string]string{},Annotations:map[string]string{control-plane.alpha.kubernetes.io/leader: {\\\"holderIdentity\\\":\\\"manager01\\\",\\\"leaseDurationSeconds\\\":15,\\\"acquireTime\\\":\\\"2017-03-31T00:11:10Z\\\",\\\"renewTime\\\":\\\"2017-04-05T08:17:06Z\\\",\\\"leaderTransitions\\\":0},},OwnerReferences:[],Finalizers:[],ClusterName:,},Subsets:[],}\" \n","stream":"stderr","time":"2017-04-05T08:17:07.227451215Z"}
{"log":"time=\"2017-04-05T08:17:07Z\" level=debug msg=\"Skipping event from kubernetes \u0026Endpoints{ObjectMeta:ObjectMeta{Name:kube-scheduler,GenerateName:,Namespace:kube-system,SelfLink:/api/v1/namespaces/kube-system/endpoints/kube-scheduler,UID:8b32c29a-15a6-11e7-bc62-000d3a272abe,ResourceVersion:19125911,Generation:0,CreationTimestamp:2017-03-31 00:11:10 +0000 UTC,DeletionTimestamp:\u003cnil\u003e,DeletionGracePeriodSeconds:nil,Labels:map[string]string{},Annotations:map[string]string{control-plane.alpha.kubernetes.io/leader: {\\\"holderIdentity\\\":\\\"manager01\\\",\\\"leaseDurationSeconds\\\":15,\\\"acquireTime\\\":\\\"2017-03-31T00:11:10Z\\\",\\\"renewTime\\\":\\\"2017-04-05T08:17:06Z\\\",\\\"leaderTransitions\\\":0},},OwnerReferences:[],Finalizers:[],ClusterName:,},Subsets:[],}\" \n","stream":"stderr","time":"2017-04-05T08:17:07.227672033Z"}
{"log":"time=\"2017-04-05T08:17:07Z\" level=debug msg=\"Received event from kubernetes \u0026Endpoints{ObjectMeta:ObjectMeta{Name:kube-controller-manager,GenerateName:,Namespace:kube-system,SelfLink:/api/v1/namespaces/kube-system/endpoints/kube-controller-manager,UID:8a36186e-15a6-11e7-a173-000d3a2725f6,ResourceVersion:19125914,Generation:0,CreationTimestamp:2017-03-31 00:11:08 +0000 UTC,DeletionTimestamp:\u003cnil\u003e,DeletionGracePeriodSeconds:nil,Labels:map[string]string{},Annotations:map[string]string{control-plane.alpha.kubernetes.io/leader: {\\\"holderIdentity\\\":\\\"manager02\\\",\\\"leaseDurationSeconds\\\":15,\\\"acquireTime\\\":\\\"2017-03-31T00:11:08Z\\\",\\\"renewTime\\\":\\\"2017-04-05T08:17:07Z\\\",\\\"leaderTransitions\\\":0},},OwnerReferences:[],Finalizers:[],ClusterName:,},Subsets:[],}\" \n","stream":"stderr","time":"2017-04-05T08:17:07.362620274Z"}
{"log":"time=\"2017-04-05T08:17:07Z\" level=debug msg=\"Skipping event from kubernetes \u0026Endpoints{ObjectMeta:ObjectMeta{Name:kube-controller-manager,GenerateName:,Namespace:kube-system,SelfLink:/api/v1/namespaces/kube-system/endpoints/kube-controller-manager,UID:8a36186e-15a6-11e7-a173-000d3a2725f6,ResourceVersion:19125914,Generation:0,CreationTimestamp:2017-03-31 00:11:08 +0000 UTC,DeletionTimestamp:\u003cnil\u003e,DeletionGracePeriodSeconds:nil,Labels:map[string]string{},Annotations:map[string]string{control-plane.alpha.kubernetes.io/leader: {\\\"holderIdentity\\\":\\\"manager02\\\",\\\"leaseDurationSeconds\\\":15,\\\"acquireTime\\\":\\\"2017-03-31T00:11:08Z\\\",\\\"renewTime\\\":\\\"2017-04-05T08:17:07Z\\\",\\\"leaderTransitions\\\":0},},OwnerReferences:[],Finalizers:[],ClusterName:,},Subsets:[],}\" \n","stream":"stderr","time":"2017-04-05T08:17:07.362877945Z"}
{"log":"time=\"2017-04-05T08:17:08Z\" level=debug msg=\"Round trip: http://10.110.43.17:8080, code: 200, duration: 1.0311ms\" \n","stream":"stderr","time":"2017-04-05T08:17:08.831157405Z"}
{"log":"time=\"2017-04-05T08:17:09Z\" level=debug msg=\"Received event from kubernetes \u0026Endpoints{ObjectMeta:ObjectMeta{Name:kube-scheduler,GenerateName:,Namespace:kube-system,SelfLink:/api/v1/namespaces/kube-system/endpoints/kube-scheduler,UID:8b32c29a-15a6-11e7-bc62-000d3a272abe,ResourceVersion:19125918,Generation:0,CreationTimestamp:2017-03-31 00:11:10 +0000 UTC,DeletionTimestamp:\u003cnil\u003e,DeletionGracePeriodSeconds:nil,Labels:map[string]string{},Annotations:map[string]string{control-plane.alpha.kubernetes.io/leader: {\\\"holderIdentity\\\":\\\"manager01\\\",\\\"leaseDurationSeconds\\\":15,\\\"acquireTime\\\":\\\"2017-03-31T00:11:10Z\\\",\\\"renewTime\\\":\\\"2017-04-05T08:17:09Z\\\",\\\"leaderTransitions\\\":0},},OwnerReferences:[],Finalizers:[],ClusterName:,},Subsets:[],}\" \n","stream":"stderr","time":"2017-04-05T08:17:09.190857205Z"}
{"log":"time=\"2017-04-05T08:17:09Z\" level=debug msg=\"Skipping event from kubernetes \u0026Endpoints{ObjectMeta:ObjectMeta{Name:kube-scheduler,GenerateName:,Namespace:kube-system,SelfLink:/api/v1/namespaces/kube-system/endpoints/kube-scheduler,UID:8b32c29a-15a6-11e7-bc62-000d3a272abe,ResourceVersion:19125918,Generation:0,CreationTimestamp:2017-03-31 00:11:10 +0000 UTC,DeletionTimestamp:\u003cnil\u003e,DeletionGracePeriodSeconds:nil,Labels:map[string]string{},Annotations:map[string]string{control-plane.alpha.kubernetes.io/leader: {\\\"holderIdentity\\\":\\\"manager01\\\",\\\"leaseDurationSeconds\\\":15,\\\"acquireTime\\\":\\\"2017-03-31T00:11:10Z\\\",\\\"renewTime\\\":\\\"2017-04-05T08:17:09Z\\\",\\\"leaderTransitions\\\":0},},OwnerReferences:[],Finalizers:[],ClusterName:,},Subsets:[],}\" \n","stream":"stderr","time":"2017-04-05T08:17:09.190904687Z"}
{"log":"time=\"2017-04-05T08:17:09Z\" level=debug msg=\"Received event from kubernetes \u0026Endpoints{ObjectMeta:ObjectMeta{Name:kube-controller-manager,GenerateName:,Namespace:kube-system,SelfLink:/api/v1/namespaces/kube-system/endpoints/kube-controller-manager,UID:8a36186e-15a6-11e7-a173-000d3a2725f6,ResourceVersion:19125919,Generation:0,CreationTimestamp:2017-03-31 00:11:08 +0000 UTC,DeletionTimestamp:\u003cnil\u003e,DeletionGracePeriodSeconds:nil,Labels:map[string]string{},Annotations:map[string]string{control-plane.alpha.kubernetes.io/leader: {\\\"holderIdentity\\\":\\\"manager02\\\",\\\"leaseDurationSeconds\\\":15,\\\"acquireTime\\\":\\\"2017-03-31T00:11:08Z\\\",\\\"renewTime\\\":\\\"2017-04-05T08:17:09Z\\\",\\\"leaderTransitions\\\":0},},OwnerReferences:[],Finalizers:[],ClusterName:,},Subsets:[],}\" \n","stream":"stderr","time":"2017-04-05T08:17:09.353150928Z"}
{"log":"time=\"2017-04-05T08:17:09Z\" level=debug msg=\"Skipping event from kubernetes \u0026Endpoints{ObjectMeta:ObjectMeta{Name:kube-controller-manager,GenerateName:,Namespace:kube-system,SelfLink:/api/v1/namespaces/kube-system/endpoints/kube-controller-manager,UID:8a36186e-15a6-11e7-a173-000d3a2725f6,ResourceVersion:19125919,Generation:0,CreationTimestamp:2017-03-31 00:11:08 +0000 UTC,DeletionTimestamp:\u003cnil\u003e,DeletionGracePeriodSeconds:nil,Labels:map[string]string{},Annotations:map[string]string{control-plane.alpha.kubernetes.io/leader: {\\\"holderIdentity\\\":\\\"manager02\\\",\\\"leaseDurationSeconds\\\":15,\\\"acquireTime\\\":\\\"2017-03-31T00:11:08Z\\\",\\\"renewTime\\\":\\\"2017-04-05T08:17:09Z\\\",\\\"leaderTransitions\\\":0},},OwnerReferences:[],Finalizers:[],ClusterName:,},Subsets:[],}\" \n","stream":"stderr","time":"2017-04-05T08:17:09.35317487Z"}
```
After that, all the terminating whoami instances I was watching with `kubectl get po --namespace tst-traefik --show-all=true -o wide` where removed. But the traefik instance still serve **whoami-3264642165-c9el0 at 10.110.98.8:80**

**Comment by shengis** [comment]
50min later, it still try to contact endpoint **10.110.98.8** :
```
09:07:46.783784 IP (tos 0x0, ttl 43, id 7240, offset 0, flags [DF], proto TCP (6), length 134)
    10.110.85.0.44358 > traefik-7m7vh.80: Flags [P.], cksum 0x7101 (correct), seq 1:83, ack 1, win 229, options [nop,nop,TS val 896212002 ecr 116410520], length 82: HTTP, length: 82
	GET / HTTP/1.1
	Host: whoami.host.net
	User-Agent: curl/7.51.0
	Accept: */*
	
09:07:46.784033 IP (tos 0x0, ttl 64, id 47945, offset 0, flags [DF], proto TCP (6), length 60)
    traefik-7m7vh.34704 > 10.110.98.8.80: Flags [S], cksum 0x7f17 (incorrect -> 0x3a79), seq 1400894433, win 28640, options [mss 1432,sackOK,TS val 116410536 ecr 0,nop,wscale 7], length 0
[...]
09:07:47.781169 IP (tos 0x0, ttl 64, id 47946, offset 0, flags [DF], proto TCP (6), length 60)
    traefik-7m7vh.34704 > 10.110.98.8.80: Flags [S], cksum 0x7f17 (incorrect -> 0x397f), seq 1400894433, win 28640, options [mss 1432,sackOK,TS val 116410786 ecr 0,nop,wscale 7], length 0
[...]
09:07:49.746245 IP (tos 0xc0, ttl 61, id 19698, offset 0, flags [none], proto ICMP (1), length 88)
    10.110.98.0 > traefik-7m7vh: ICMP host 10.110.98.8 unreachable, length 68
	IP (tos 0x0, ttl 60, id 47945, offset 0, flags [DF], proto TCP (6), length 60)
    traefik-7m7vh.34704 > 10.110.98.8.80: Flags [S], cksum 0x3a79 (correct), seq 1400894433, win 28640, options [mss 1432,sackOK,TS val 116410536 ecr 0,nop,wscale 7], length 0
09:07:49.746259 IP (tos 0x0, ttl 64, id 47947, offset 0, flags [DF], proto TCP (6), length 60)
    traefik-7m7vh.34704 > 10.110.98.8.80: Flags [S], cksum 0x7f17 (incorrect -> 0x3794), seq 1400894433, win 28640, options [mss 1432,sackOK,TS val 116411277 ecr 0,nop,wscale 7], length 0
09:07:49.746304 IP (tos 0xc0, ttl 61, id 19699, offset 0, flags [none], proto ICMP (1), length 88)
    10.110.98.0 > traefik-7m7vh: ICMP host 10.110.98.8 unreachable, length 68
	IP (tos 0x0, ttl 60, id 47946, offset 0, flags [DF], proto TCP (6), length 60)
    traefik-7m7vh.34704 > 10.110.98.8.80: Flags [S], cksum 0x397f (correct), seq 1400894433, win 28640, options [mss 1432,sackOK,TS val 116410786 ecr 0,nop,wscale 7], length 0
09:07:49.746568 IP (tos 0x0, ttl 64, id 14388, offset 0, flags [DF], proto TCP (6), length 189)
    traefik-7m7vh.80 > 10.110.85.0.44358: Flags [P.], cksum 0x7290 (incorrect -> 0xa5fe), seq 1:138, ack 83, win 222, options [nop,nop,TS val 116411277 ecr 896212002], length 137: HTTP, length: 137
	HTTP/1.1 502 Bad Gateway
	Date: Wed, 05 Apr 2017 09:07:49 GMT
	Content-Length: 11
	Content-Type: text/plain; charset=utf-8
	
	Bad Gateway[!http]
```

while, it doesn't exist anymore :
```
$ kubectl get po --namespace tst-traefik --show-all=true -o wide

NAME                      READY     STATUS    RESTARTS   AGE       IP             NODE
traefik-7m7vh             1/1       Running   0          59m       10.110.8.5     worker02
traefik-vitbe             1/1       Running   0          58m       10.110.43.17   worker05
traefik-xppdr             1/1       Running   0          58m       10.110.35.10   worker03
whoami-1006074904-4fv8v   1/1       Running   0          55m       10.110.85.7    worker04
whoami-1006074904-m1za4   1/1       Running   0          55m       10.110.43.9    worker05
whoami-1006074904-vo868   1/1       Running   0          54m       10.110.35.8    worker03
```

**Comment by timoreimann** [comment]
Could you check the endpoints REST API for your namespace and paste the endpoints still available at the moment where the problem persists?

Traefik should only include servers which are listed as Endpoints associated to Services associated to Ingresses.

**Comment by shengis** [comment]
Ok, so I have re-done the rolling-update.

Before rolling-update :
```
$ kubectl get po --namespace tst-traefik --show-all=true -o wide      

NAME                      READY     STATUS    RESTARTS   AGE       IP             NODE
traefik-7m7vh             1/1       Running   0          6h        10.110.8.5     worker02
traefik-vitbe             1/1       Running   0          5h        10.110.43.17   worker05
traefik-xppdr             1/1       Running   0          5h        10.110.35.10   worker03
whoami-3264642165-cp46p   1/1       Running   0          1m        10.110.35.14   worker03
whoami-3264642165-paw91   1/1       Running   0          1m        10.110.8.4     worker02
whoami-3264642165-pihry   1/1       Running   0          1m        10.110.29.5    worker01
```

After rolling-update :
```
$ kubectl get po --namespace tst-traefik --show-all=true -o wide

NAME                      READY     STATUS    RESTARTS   AGE       IP             NODE
traefik-7m7vh             1/1       Running   0          6h        10.110.8.5     worker02
traefik-vitbe             1/1       Running   0          6h        10.110.43.17   worker05
traefik-xppdr             1/1       Running   0          6h        10.110.35.10   worker03
whoami-1006074904-7lw1i   1/1       Running   0          13s       10.110.85.7    worker04
whoami-1006074904-pokz5   1/1       Running   0          9s        10.110.35.8    worker03
whoami-1006074904-th5nj   1/1       Running   0          13s       10.110.43.2    worker05
```

Endpoints via API :
```
{
  "kind": "EndpointsList",
  "apiVersion": "v1",
  "metadata": {
    "selfLink": "/api/v1/namespaces/tst-traefik/endpoints",
    "resourceVersion": "19176477"
  },
  "items": [
    {
      "metadata": {
        "name": "traefik",
        "namespace": "tst-traefik",
        "selfLink": "/api/v1/namespaces/tst-traefik/endpoints/traefik",
        "uid": "18bddbac-1870-11e7-a173-000d3a2725f6",
        "resourceVersion": "19125256",
        "creationTimestamp": "2017-04-03T13:18:58Z"
      },
      "subsets": [
        {
          "addresses": [
            {
              "ip": "10.110.35.10",
              "nodeName": "worker03",
              "targetRef": {
                "kind": "Pod",
                "namespace": "tst-traefik",
                "name": "traefik-xppdr",
                "uid": "be4a7f09-19d7-11e7-a173-000d3a2725f6",
                "resourceVersion": "19125235"
              }
            },
            {
              "ip": "10.110.43.17",
              "nodeName": "worker05",
              "targetRef": {
                "kind": "Pod",
                "namespace": "tst-traefik",
                "name": "traefik-vitbe",
                "uid": "be4a85cf-19d7-11e7-a173-000d3a2725f6",
                "resourceVersion": "19125253"
              }
            },
            {
              "ip": "10.110.8.5",
              "nodeName": "worker02",
              "targetRef": {
                "kind": "Pod",
                "namespace": "tst-traefik",
                "name": "traefik-7m7vh",
                "uid": "8dcb536a-19d7-11e7-a173-000d3a2725f6",
                "resourceVersion": "19125039"
              }
            }
          ],
          "ports": [
            {
              "name": "webui",
              "port": 8080,
              "protocol": "TCP"
            },
            {
              "name": "http",
              "port": 80,
              "protocol": "TCP"
            }
          ]
        }
      ]
    },
    {
      "metadata": {
        "name": "whoami",
        "namespace": "tst-traefik",
        "selfLink": "/api/v1/namespaces/tst-traefik/endpoints/whoami",
        "uid": "4b0fac51-1944-11e7-a173-000d3a2725f6",
        "resourceVersion": "19174510",
        "creationTimestamp": "2017-04-04T14:37:56Z",
        "labels": {
          "app": "whoami",
          "environment": "tst-traefik"
        }
      },
      "subsets": [
        {
          "addresses": [
            {
              "ip": "10.110.35.8",
              "nodeName": "worker03",
              "targetRef": {
                "kind": "Pod",
                "namespace": "tst-traefik",
                "name": "whoami-1006074904-pokz5",
                "uid": "4415340a-1a0a-11e7-a173-000d3a2725f6",
                "resourceVersion": "19174501"
              }
            },
            {
              "ip": "10.110.43.2",
              "nodeName": "worker05",
              "targetRef": {
                "kind": "Pod",
                "namespace": "tst-traefik",
                "name": "whoami-1006074904-th5nj",
                "uid": "41c8294c-1a0a-11e7-a173-000d3a2725f6",
                "resourceVersion": "19174453"
              }
            },
            {
              "ip": "10.110.85.7",
              "nodeName": "worker04",
              "targetRef": {
                "kind": "Pod",
                "namespace": "tst-traefik",
                "name": "whoami-1006074904-7lw1i",
                "uid": "41c81860-1a0a-11e7-a173-000d3a2725f6",
                "resourceVersion": "19174444"
              }
            }
          ],
          "ports": [
            {
              "name": "http",
              "port": 80,
              "protocol": "TCP"
            }
          ]
        }
      ]
    }
  ]
}
```

Traefik trying to access endpoint 10.110.8.4 :
```
14:31:39.954170 IP (tos 0x0, ttl 43, id 64405, offset 0, flags [DF], proto TCP (6), length 134)
    10.110.85.0.49146 > traefik-xppdr.80: Flags [P.], cksum 0x59ef (correct), seq 1:83, ack 1, win 229, options [nop,nop,TS val 915645095 ecr 123278237], length 82: HTTP, length: 82
	GET / HTTP/1.1
	Host: whoami.host.net
	User-Agent: curl/7.51.0
	Accept: */*
	
14:31:39.954472 IP (tos 0x0, ttl 64, id 31172, offset 0, flags [DF], proto TCP (6), length 60)
    traefik-xppdr.38238 > 10.110.8.4.80: Flags [S], cksum 0x4018 (incorrect -> 0x4614), seq 925657703, win 28640, options [mss 1432,sackOK,TS val 123278243 ecr 0,nop,wscale 7], length 0
14:31:40.957992 IP (tos 0x0, ttl 64, id 31173, offset 0, flags [DF], proto TCP (6), length 60)
    traefik-xppdr.38238 > 10.110.8.4.80: Flags [S], cksum 0x4018 (incorrect -> 0x4519), seq 925657703, win 28640, options [mss 1432,sackOK,TS val 123278494 ecr 0,nop,wscale 7], length 0
[...]
14:31:42.963117 IP (tos 0x0, ttl 64, id 31174, offset 0, flags [DF], proto TCP (6), length 60)
    traefik-xppdr.38238 > 10.110.8.4.80: Flags [S], cksum 0x4018 (incorrect -> 0x4323), seq 925657703, win 28640, options [mss 1432,sackOK,TS val 123278996 ecr 0,nop,wscale 7], length 0
14:31:42.970520 IP (tos 0xc0, ttl 61, id 9285, offset 0, flags [none], proto ICMP (1), length 88)
    10.110.8.0 > traefik-xppdr: ICMP host 10.110.8.4 unreachable, length 68
	IP (tos 0x0, ttl 60, id 31172, offset 0, flags [DF], proto TCP (6), length 60)
    traefik-xppdr.38238 > 10.110.8.4.80: Flags [S], cksum 0x4614 (correct), seq 925657703, win 28640, options [mss 1432,sackOK,TS val 123278243 ecr 0,nop,wscale 7], length 0
14:31:42.970554 IP (tos 0xc0, ttl 61, id 9286, offset 0, flags [none], proto ICMP (1), length 88)
    10.110.8.0 > traefik-xppdr: ICMP host 10.110.8.4 unreachable, length 68
	IP (tos 0x0, ttl 60, id 31173, offset 0, flags [DF], proto TCP (6), length 60)
    traefik-xppdr.38238 > 10.110.8.4.80: Flags [S], cksum 0x4519 (correct), seq 925657703, win 28640, options [mss 1432,sackOK,TS val 123278494 ecr 0,nop,wscale 7], length 0
14:31:42.970558 IP (tos 0xc0, ttl 61, id 9287, offset 0, flags [none], proto ICMP (1), length 88)
    10.110.8.0 > traefik-xppdr: ICMP host 10.110.8.4 unreachable, length 68
	IP (tos 0x0, ttl 60, id 31174, offset 0, flags [DF], proto TCP (6), length 60)
    traefik-xppdr.38238 > 10.110.8.4.80: Flags [S], cksum 0x4323 (correct), seq 925657703, win 28640, options [mss 1432,sackOK,TS val 123278996 ecr 0,nop,wscale 7], length 0
14:31:42.970721 IP (tos 0x0, ttl 64, id 53715, offset 0, flags [DF], proto TCP (6), length 189)
    traefik-xppdr.80 > 10.110.85.0.49146: Flags [P.], cksum 0x8d95 (incorrect -> 0x97ee), seq 1:138, ack 83, win 222, options [nop,nop,TS val 123278997 ecr 915645095], length 137: HTTP, length: 137
	HTTP/1.1 502 Bad Gateway
	Date: Wed, 05 Apr 2017 14:31:42 GMT
	Content-Length: 11
	Content-Type: text/plain; charset=utf-8
	
	Bad Gateway[!http]
```

**Comment by shengis** [comment]
On the webui of Traefik, as I have 3 instances, it's cycling between :
![capture d ecran de 2017-04-05 17-16-05](https://cloud.githubusercontent.com/assets/20049990/24713311/958b66d2-1a25-11e7-8d44-61aa24334f64.png)
and
![capture d ecran de 2017-04-05 17-16-07](https://cloud.githubusercontent.com/assets/20049990/24713320/9c2cfa3c-1a25-11e7-884f-d0792eb256cf.png)

**Comment by timoreimann** [comment]
When you say cycling, do you mean the state goes back and forth between correct and wrong? Or does it rather stick in the flawed state?

**Comment by shengis** [comment]
Yes, I mean cycling back and forth between the correct and the wrong state. Since I have more than one instance of Traefik running, I think the instances are only partly affected.

**Comment by timoreimann** [comment]
@shengis could you query the Endpoints endpoint (and, just to be sure, the Ingress and Services ones too) continuously to see if they oscillate too at some point?

I'd like to figure out if this is a problem on the k8s end which Traefik is just resonating, or rather a problem with the proxy itself.

**Comment by timoreimann** [comment]
It's been a while since we've touched this issue.

@shengis if you are still experiencing problems, please give the latest Traefik release (1.3.3 as of today) a shot and report back if the issue persists. I'll optimistically close the issue for the time being.
